Uniq Id,Product Name,Brand Name,Asin,Category,Upc Ean Code,List Price,Selling Price,Quantity,Model Number,About Product,Product Specification,Technical Details,Shipping Weight,Product Dimensions,Image,Variants,Sku,Product Url,Stock,Product Details,Dimensions,Color,Ingredients,Direction To Use,Is Amazon Seller,Size Quantity Variant,Product Description
4c69b61db1fc16e7013b43fc926e502d,"DB Longboards CoreFlex Crossbow 41"" Bamboo Fiberglass Longboard Complete",,,"Sports & Outdoors | Outdoor Recreation | Skates, Skateboards & Scooters | Skateboarding | Standard Skateboards & Longboards | Longboards","",,$237.68,,"","Make sure this fits by entering your model number. | RESPONSIVE FLEX: The Crossbow features a bamboo core encased in triaxial fiberglass and HD plastic for a responsive flex pattern that’s second to none. Pumping & carving have never been so satisfying! Flex 2 is recommended for people 120 to 170 pounds. | COREFLEX TECH: CoreFlex construction is water resistant, impact resistant, scratch resistant and has a flex like you won’t believe. These boards combine fiberglass, epoxy, HD plastic and bamboo to create a perfect blend of performance and strength. | INSPIRED BY THE NORTHWEST: Our founding ideal is chasing adventure & riding the best boards possible, inspired by the hills, waves, beaches & mountains all around our headquarters in the Northwest | BEST IN THE WORLD: DB was founded out of sheer love of longboarding with a mission to create the best custom longboards in the world, to do it sustainably, & to treat customers & employees like family | BEYOND COMPARE: Try our skateboards & accessories if you've tried similar products by Sector 9, Landyachtz, Arbor, Loaded, Globe, Orangatang, Hawgs, Powell-Peralta, Blood Orange, Caliber or Gullwing",Shipping Weight: 10.7 pounds (View shipping rates and policies)|ASIN: B07KMVJJK7|    #474    in Longboards Skateboard,"",10.7 pounds,"",https://images-na.ssl-images-amazon.com/images/I/51j3fPQTQkL.jpg|https://images-na.ssl-images-amazon.com/images/I/31hKM3cSoSL.jpg|https://images-na.ssl-images-amazon.com/images/I/51WlHdwghfL.jpg|https://images-na.ssl-images-amazon.com/images/I/51FsyLRBzwL.jpg|https://images-na.ssl-images-amazon.com/images/G/01/x-locale/common/transparent-pixel.jpg,https://www.amazon.com/DB-Longboards-CoreFlex-Fiberglass-Longboard/dp/B07KMVJJK7|https://www.amazon.com/DB-Longboards-CoreFlex-Fiberglass-Longboard/dp/B07KMN5KS7|https://www.amazon.com/DB-Longboards-CoreFlex-Fiberglass-Longboard/dp/B07KMXK857|https://www.amazon.com/DB-Longboards-CoreFlex-Fiberglass-Longboard/dp/B07KMW2VFR,,https://www.amazon.com/DB-Longboards-CoreFlex-Fiberglass-Longboard/dp/B07KMVJJK7,,,,,,,Y,,
66d49bbed043f5be260fa9f7fbff5957,"Electronic Snap Circuits Mini Kits Classpack, FM Radio, Motion Detector, Music Box (Set of 5)",,,Toys & Games | Learning & Education | Science Kits & Toys,,,$99.95,,55324,"Make sure this fits by entering your model number. | Snap circuits mini kits classpack provides basic electronic circuitry activities for students in grades 2-6 | Includes 5 separate mini building kits- an FM radio, a motion detector, music box, space battle sound effects, and a flying saucer | Each kit includes separate components and instructions to build | Each component represents one function in a circuit; components snap together to create working models of everyday electronic devices | Activity guide provides additional projects to teach students how circuitry works",Product Dimensions:         14.7 x 11.1 x 10.2 inches ; 4.06 pounds    |Shipping Weight: 4 pounds (View shipping rates and policies)|Domestic Shipping: Item can be shipped within U.S.|International Shipping: This item can be shipped to select countries outside of the U.S.  Learn More|ASIN: B008AK6DAS|Item model number: 55324|    #3032    in Science Kits & Toys,"The snap circuits mini kits classpack provides basic electric circuitry information for students in grades 2-6. This classpack includes 5 snap-together building kits. Components snap together to create working models of everyday electronic devices. Kits included are an FM radio, a motion detector, a music box, space battle sound effects, and a flying saucer. Each mini kit comes with individual components, and an activity guide which includes instructions and additional project ideas. Each primary-colored component represents one function in a circuit. Activity kits are used by teachers and students in classroom and homeschool settings for educational and research applications in science, math, and for a variety of additional disciplines. Science education products and manipulatives incorporate applied math and science principles into classroom or homeschool projects. Teachers in pre-K, elementary, and secondary classrooms use science education kits, manipualtives, and products alongside science, technology, engineering, and math (STEM) curriculum to demonstrate STEM concepts and real-world applications through hands-on activities. Science education projects include a broad range of activities, such as practical experiments in engineering, aeronautics, robotics, chemistry, physics, biology, and geology.",4 pounds,14.7 x 11.1 x 10.2 inches  4.06 pounds,https://images-na.ssl-images-amazon.com/images/I/51M0KnJxjKL.jpg|https://images-na.ssl-images-amazon.com/images/I/5166GD8OkXL.jpg|https://images-na.ssl-images-amazon.com/images/I/61o5S1VnaNL.jpg|https://images-na.ssl-images-amazon.com/images/I/61t4Q0rPYjL.jpg|https://images-na.ssl-images-amazon.com/images/I/61NASUAyqcL.jpg|https://images-na.ssl-images-amazon.com/images/I/51OMrADdyJL.jpg|https://images-na.ssl-images-amazon.com/images/G/01/x-locale/common/transparent-pixel.jpg,"",,https://www.amazon.com/Electronic-Circuits-Classpack-Motion-Detector/dp/B008AK6DAS,,,,,,,Y,,
2c55cae269aebf53838484b0d7dd931a,"3Doodler Create Flexy 3D Printing Filament Refill Bundle (X5 Pack, Over 1000'. of Extruded Plastics! - Innovate",,,Toys & Games | Arts & Crafts | Craft Kits,,,$34.99,,"","Make sure this fits by entering your model number. | ✅【Smooth 3D drawing experienced the best 3D drawing experience by only using 3Doodler Create Plastics with 3Doodler Create+ and create 3D Printing pen. | ✅【Safe to use】the 3Doodler Create Plastics, conforms to the health requirements of ASTM-D-4236 & require no additional labelling in accordance with the US Consumer Product safety Commission’s Regulations as mandated by Labeling of Hazardous Art Materials Act (LHAMA). | 👍【3Doodler very own Type of plastic】the FLEXY plastic takes creativity to new levels! You can make flexible fun 3D creations! | 🌍【Environmentally friendly】3doodler create Plastic is made of corn and are 100% compostable! | ✅【125 strands of drawing fun】this bundle includes 5 refill filament packs, that's a total of 1043 ft. Of 3D drawing and doodling fun! | 📱【The 3Doodler app】get an interactive experience! The app is packed with dedicated easy to follow stencil section and step by step interactive instructions, receive badges for completed projects and photograph & share YOUR creations directly on social media. The app is fully built on iOS & Android. | ✅【All your favorite colors】this pack includes: green, blue, pink, orange & yellow",ProductDimensions:10.3x3.4x0.8inches|ItemWeight:12.8ounces|ShippingWeight:12.8ounces(Viewshippingratesandpolicies)|ASIN:B07D36747F|Manufacturerrecommendedage:14yearsandup,"show up to 2 reviews by default No longer are you bound by the rigid constraints of hard plastic! Our FLEXY line you can now squeeze, stretch, and twist your creations providing a truly dynamic Doodling experience. Do you want to take your creativity to new levels? Explore the wide variety of FLEXY plastic refill colors for your 3Doodler Create 3D pen! Flexy Plastics are compatible with the 3Doodler V.1, 2.0, and create 3D printing pens. Available in single & mixed color pack containing 25 strands each, and single colors tubes containing 100 strands. | 12.8 ounces (View shipping rates and policies)",12.8 ounces,"",https://images-na.ssl-images-amazon.com/images/I/513cBC8PqpL.jpg|https://images-na.ssl-images-amazon.com/images/G/01/x-locale/common/transparent-pixel.jpg,"",,https://www.amazon.com/3Doodler-Plastic-Innovate-Filament-Refills/dp/B07D36747F,,,,,,,Y,,
18018b6bc416dab347b1b7db79994afa,Guillow Airplane Design Studio with Travel Case Building Kit,,,Toys & Games | Hobbies | Models & Model Kits | Model Kits | Airplane & Jet Kits,,,$28.91,,142,Make 8 different Planes at one time. | Experiment with different designs and learn about flight. | All contained in Part trays inside an attractive box with carry handle! | Guillow's - your one source for flying toys since 1926. | Made in the USA.,ProductDimensions:3.5x6.2x13inches|ItemWeight:13.4ounces|ShippingWeight:13.4ounces(Viewshippingratesandpolicies)|DomesticShipping:ItemcanbeshippedwithinU.S.|InternationalShipping:ThisitemcanbeshippedtoselectcountriesoutsideoftheU.S.LearnMore|ASIN:B076Y2SNHM|Itemmodelnumber:142|Manufacturerrecommendedage:8yearsandup,"Go to your orders and start the return Select the ship method Ship it! | Go to your orders and start the return Select the ship method Ship it! | 13.4 ounces (View shipping rates and policies) | show up to 2 reviews by default Kit contains parts to let your imagination soar and build flying planes! comes with over 35 parts (balsa wood wings, tails & bodies, plastic propellers and landing gear, rubber motors, etc) to let you build your own unique flying toy designs. Simple to build, easy to fly and hours of fun!",13.4 ounces,"",https://images-na.ssl-images-amazon.com/images/I/516UijZMilL.jpg|https://images-na.ssl-images-amazon.com/images/I/51J6y3oM6VL.jpg|https://images-na.ssl-images-amazon.com/images/G/01/x-locale/common/transparent-pixel.jpg,"",,https://www.amazon.com/Guillow-Airplane-Design-Studio-Building/dp/B076Y2SNHM,,,,,,,Y,,
e04b990e95bf73bbe6a3fa09785d7cd0,Woodstock- Collage 500 pc Puzzle,,,Toys & Games | Puzzles | Jigsaw Puzzles,"",,$17.49,,62151,Make sure this fits by entering your model number. | Puzzle has 500 pieces | Completed puzzle measure 14 x 19 | 100% officially licensed merchandise | Great for fans & puzzlers alike,ProductDimensions:1.9x8x10inches|ItemWeight:13.4ounces|ShippingWeight:13.4ounces(Viewshippingratesandpolicies)|ASIN:B07MX21WWX|Itemmodelnumber:62151|Manufacturerrecommendedage:14yearsandup,show up to 2 reviews by default 100% Officially licensed merchandise; complete puzzle measures 14 x 19 in. | 13.4 ounces (View shipping rates and policies),13.4 ounces,"",https://images-na.ssl-images-amazon.com/images/I/61plo8Xv4vL.jpg|https://images-na.ssl-images-amazon.com/images/G/01/x-locale/common/transparent-pixel.jpg,"",,https://www.amazon.com/Woodstock-Collage-500-pc-Puzzle/dp/B07MX21WWX,,,,,,,Y,,
f8c32a45e507a177992973cf0d46d20c,"Terra by Battat – 4 Dinosaur Toys, Medium – Dinosaurs for Kids & Collectors, Scientifically Accurate & Designed by A Paleo-Artist; Age 3+ (4 Pc)",,,"","",,$18.66,,AN4054Z,"Make sure this fits by entering your model number. | 4 medium-sized dinosaurs for kids, with lifelike pose, accurate ratio, and exquisitely detailed paint | Includes: Parasaurolophus walkeri, Stegosaurus ungulatus, Pachyrhinosaurus, and euoplocephalus tutus toy dinos | Museum Quality: classic toy dinosaurs designed by an internationally renowned paleo-artist | Educational toy: dinosaur toys for kids spark curiosity about paleontology, science, and natural History | Dimensions: Dimensions: miniature figurines measure 6.25-8.5 (L) 1.5-2.25 (W) 2.25-3.5 (H) inches approximately toys 6.25-8.5 (L) 1.5-2.25 (W) 2.25-3.5 (H) inches approximately | No batteries required, just imagination! | Earth-friendly recyclable packaging | Age: suggested for ages 3+ | Collect them all! Discover the entire Terra by Battat family of animal toy figurines and dinosaur playsets!",ProductDimensions:8.7x3.9x3.4inches|ItemWeight:15.8ounces|ShippingWeight:1.4pounds(Viewshippingratesandpolicies)|ASIN:B07PF1R8LS|Itemmodelnumber:AN4054Z|Manufacturerrecommendedage:36months-10years,"Go to your orders and start the return Select the ship method Ship it! | Go to your orders and start the return Select the ship method Ship it! | show up to 2 reviews by default Look out! Here come 4 incredible dinosaur toys that look like the real thing! Sought after by both kids and collectors, These scientifically precise and very collectable dinosaur replicas also feature bright, beautiful colors and look amazing in any dinosaur playset. And, they're made with high quality material, so these dinos will never go extinct! The intimidating-looking, and instantly recognizable Stegosaurus was the largest of plate-backed prehistoric herbivores. Scientists have suggested that the Stegosaurus’ iconic plates were for defense against predators, but this is unlikely as the plates were quite thin. Others have said the Stegosaurus’ spiked tail may have been used as a weapon. Terra’s Stegosaurus toy accurately recreates the formidable size and terrifying presence of this iconic predator. In particular, the large, heavily built frame and rounded backs of the mighty Stegosaurus are faithfully depicted in the dinosaur replica. This highly collectable playset also includes a toy Parasaurolophus, Stegosaurus, Pachyrhinosaurus, and euoplocephalus tutus. Collect your own miniature versions of 4 powerful and iconic dinosaurs from Terra by Battat! | 1.4 pounds (View shipping rates and policies)",1.4 pounds,"",https://images-na.ssl-images-amazon.com/images/I/41EdPcg0uzL.jpg|https://images-na.ssl-images-amazon.com/images/I/410KcPi9ieL.jpg|https://images-na.ssl-images-amazon.com/images/I/41wU2y7soKL.jpg|https://images-na.ssl-images-amazon.com/images/I/51NIuTiNR1L.jpg|https://images-na.ssl-images-amazon.com/images/I/41lqmJ8s-EL.jpg|https://images-na.ssl-images-amazon.com/images/I/41mJemzRLAL.jpg|https://images-na.ssl-images-amazon.com/images/I/61kyhPnISgL.jpg|https://images-na.ssl-images-amazon.com/images/G/01/x-locale/common/transparent-pixel.jpg,"",,https://www.amazon.com/Terra-Battat-Dinosaurs-Collectable-Stegosaurus/dp/B07PF1R8LS,,,,,,,Y,,
40d3cd16b41970ae6872e914aecf2c8e,"Rubie's Child's Pokemon Deluxe Pikachu Costume, X-Small",,,"Clothing, Shoes & Jewelry | Costumes & Accessories | Kids & Baby | Girls | Costumes",,,$29.12,,B07BZJM592,"Make sure this fits by entering your model number. | Polyester | Deluxe Pokemon child's Pikachu costume features a fleece jumpsuit with attached tail and headpiece with attached ears and printed face | Officially licensed Pokemon costume, look for trademark on packaging and label to help assure you've received authentic safety-tested item | Important: Costumes are sized differently than apparel, use the Rubie's Child Size Chart, do not choose based on child's age or clothing size | Group costume fun: coordinate with additional Pokemon costumes and accessories available from Rubie's | Family-owned, family-focused, and based in the U.S.A. Since 1951, Rubie's has classic and licensed costumes and accessories in sizes and styles for your entire family",ProductDimensions:16x8x1inches|ItemWeight:1pounds|ShippingWeight:9.8ounces(Viewshippingratesandpolicies)|ASIN:B07BZJM592|Itemmodelnumber:B07BZJM592|Manufacturerrecommendedage:12month-2years,"Go to your orders and start the return Select the ship method Ship it! | Go to your orders and start the return Select the ship method Ship it! | Size:Toddler Transform into the popular and cute mouse-like Pokemon while on the hunt. Officially licensed deluxe Pokemon child's Pikachu costume Featuring a fleece jumpsuit with attached tail and headpiece with attached ears and printed face. Costumes are sized differently than apparel, use the Rubies child's size chart, do not choose based on child's age or clothing size. Pair with other Rubie's Officially Licensed Pokemon costumes for group or family fun! Look for Pikachu, Ash, Misty, Brock, Dawn, clemont, Serena, cilan, may, Squirtle, Charizard, and many more! Rubie's brings fun and fantasy to dress-up with the broadest selection of costumes and accessories, offering everything from full mascot suits to masks and wigs, from deluxe licensed costumes to simple starter pieces, from costume shoes to character make-up, and so much more. Family-owned, family-focused, and based in new York since 1951, you can look to Rubie's for every costume occasion and season: Halloween, Christmas, Mardi Gras, Easter, and all in-between. | 9.8 ounces (View shipping rates and policies)",9.8 ounces,"",https://images-na.ssl-images-amazon.com/images/I/311yBLR6GiL.jpg|https://images-na.ssl-images-amazon.com/images/G/01/x-locale/common/transparent-pixel.jpg,https://www.amazon.com/Rubies-Deluxe-Pikachu-Pokemon-Costume/dp/B07BZJM592|https://www.amazon.com/Rubies-Deluxe-Pikachu-Pokemon-Costume/dp/B004XV389W|https://www.amazon.com/Rubies-Deluxe-Pikachu-Pokemon-Costume/dp/B004XV382E|https://www.amazon.com/Rubies-Deluxe-Pikachu-Pokemon-Costume/dp/B004XV37WA|https://www.amazon.com/Rubies-Deluxe-Pikachu-Pokemon-Costume/dp/B07BZKQ81J,,https://www.amazon.com/Rubies-Deluxe-Pikachu-Pokemon-Costume/dp/B07BZJM592,,,,,,,Y,,
bc178f33a04dbccefa95b165f8b56830,"Hoffmaster 120813 Double-Tipped Triangular Crayon, 88 mm Length, Wrapped (500 Packs of 2)",,,Toys & Games | Arts & Crafts | Drawing & Painting Supplies | Crayons,,,$97.68,,"","","","","","",https://images-na.ssl-images-amazon.com/images/I/41RQ9OU%2BTPL.jpg,"",,https://www.amazon.com/Hoffmaster-120813-Double-Tipped-Triangular-Wrapped/dp/B00BS7XCZ4,,,,,,,Y,,
cc2083338a16c3fe2f7895289d2e98fe,"ARTSCAPE Etched Glass 24"" x 36"" Window Film, 24-by-36-Inch",,,Home & Kitchen | Home Décor | Window Treatments | Window Stickers & Films | Window Films,"",,$12.99,,01-0121,Make sure this fits by entering your model number. | The visual effect of textured glass and stained glass | Creates privacy / Provides UV protection | No adhesives / Applies easily | Patterns repeat to cover any size window | Made in USA,ProductDimensions:72x36x0inches|ItemWeight:11.2ounces|ShippingWeight:12.2ounces(Viewshippingratesandpolicies)|Manufacturer:Artscape|ASIN:B000Q3PRYA|DomesticShipping:ItemcanbeshippedwithinU.S.|InternationalShipping:ThisitemcanbeshippedtoselectcountriesoutsideoftheU.S.LearnMore|ShippingAdvisory:Thisitemmustbeshippedseparatelyfromotheritemsinyourorder.Additionalshippingchargeswillnotapply.|Itemmodelnumber:01-0121,"show up to 2 reviews by default Product Description Artscape window films create the look of stained and etched glass. These thin, translucent films provide privacy while still allowing natural light to enter the room. Artscape films are easily applied to any smooth glass surface. They do not use adhesives and are easily removed if needed. They can be trimmed or combined to fit any size window. The images have a repeating pattern left to right and top to bottom and can be used either vertically or horizontally. These films provide UV protection and are the perfect decorative accent for windows that require continued privacy. Artscape patented products are all made in the USA. From the Manufacturer Artscape window films create the look of stained and etched glass. These thin, translucent films provide privacy while still allowing natural light to enter the room. Artscape films are easily applied to any smooth glass surface. They do not use adhesives and are easily removed if needed. They can be trimmed or combined to fit any size window. The images have a repeating pattern left to right and top to bottom and can be used either vertically or horizontally. These films provide UV protection and are the perfect decorative accent for windows that require continued privacy. Artscape patented products are all made in the USA. | 12.2 ounces (View shipping rates and policies)",12.2 ounces,"",https://images-na.ssl-images-amazon.com/images/I/51iAe3LF7FL.jpg|https://images-na.ssl-images-amazon.com/images/I/417B20oEehL.jpg|https://images-na.ssl-images-amazon.com/images/I/41J3bDg633L.jpg|https://images-na.ssl-images-amazon.com/images/I/51hhnuGWwdL.jpg|https://images-na.ssl-images-amazon.com/images/G/01/x-locale/common/transparent-pixel.jpg,"",,https://www.amazon.com/ARTSCAPE-Etched-Glass-Window-Film/dp/B000Q3PRYA,,,,,,,Y,,
69828c5570dcdbd1609216d33fbad0db,Pokemon TCG: Sun and Moon Crimson Invasion Elite Trainer Box,,,"",,,$38.49,,820650802607-1,"Make sure this fits by entering your model number. | The Pokémon TCG: Sun & Moon—Crimson Invasion Elite Trainer Box includes: | 8 Pokémon TCG: Sun & Moon Crimson Invasion booster packs, 65 card sleeves featuring Silvally, 45 Pokémon TCG Energy cards, 6 damage-counter dice | 2 acrylic condition markers and 1 acrylic GX marker, 1 competition-legal coin-flip die | A collector's box to hold everything, with 4 dividers to keep it organized, A player's guide to the Sun & Moon—Crimson Invasion expansion, A code card for the Pokemon Trading Card Game | Official Release Date: November 3rd, 2017",ProductDimensions:7.5x3.5x6.8inches|ItemWeight:1.5pounds|ShippingWeight:1.5pounds(Viewshippingratesandpolicies)|DomesticShipping:ItemcanbeshippedwithinU.S.|InternationalShipping:ThisitemcanbeshippedtoselectcountriesoutsideoftheU.S.LearnMore|ASIN:B074NCGNX2|Itemmodelnumber:820650802607-1|Manufacturerrecommendedage:6yearsandup,"show up to 2 reviews by default Crimson Choas Across Alola! The mystrious Ultra Beasts have arrived, invading the Alola region as crimson-tinged Pokemon-GX: Nihilego-GX, Buzzwole-GX, Kartana-GX, and the ravenous Guzzlord-GX! Can Silvally-GX and the other allies of Alola defend the islands-or will the Ultra Beasts take control? Find out when you battle for the proze with the Pokemon Trading Card: Sun & Moon Crimson Invasion expansion! | 1.5 pounds (View shipping rates and policies)",1.5 pounds,"",https://images-na.ssl-images-amazon.com/images/I/51LFAQfMX6L.jpg|https://images-na.ssl-images-amazon.com/images/G/01/x-locale/common/transparent-pixel.jpg,"",,https://www.amazon.com/Pokemon-TCG-Crimson-Invasion-Trainer/dp/B074NCGNX2,,,,,,,Y,,
7b0746d8afc8462ba17f8a763d9d5f1e,"Moonlite, 3-Story Bundle for Boys, Includes 3 Story Reels for Use with Storybook Projector",,,Toys & Games | Baby & Toddler Toys,,,$18.16,,6054517,"Make sure this fits by entering your model number. | 3 story reels: make reading even more magical with the Moonlite story reels bundle! With 3 story reels included in this set, read adventure-filled tales about Pirates, Dragon and a T-Rex to your little boy any time of day, and enjoy them again and again! | Easy-to-use portable storybook projector: The tales included in this 3-pack come alive with Moonlite! Clip the projector (sold separately) onto your smartphone (not included), slide in one of the set's story reels and project vibrant images onto any surface! Moonlite is lightweight and small enough to carry with you wherever you go. | Develop a love of learning: adored by children and adults, award-winning Moonlite and the story reels create an immersive reading experience that instills a love of learning at a young age. As kids follow along to their favorite stories, they develop their imagination, creativity and language skills. | The Moonlite 3-story bundle makes a great gift for boys aged 3 and up and includes 3 story reels. Read tales like how to be a pirate, there was an old Dragon who swallowed a Knight and I'm a T.Rex! Works with the Moonlite storybook projector (sold separately). | Includes: 3 story reels, 1 activation card, 1 quick start guide",ProductDimensions:0.8x5x8.2inches|ItemWeight:3.2ounces|ShippingWeight:3.2ounces(Viewshippingratesandpolicies)|ASIN:B07NPJNZ9T|Itemmodelnumber:6054517|Manufacturerrecommendedage:36months-5years,"Go to your orders and start the return Select the ship method Ship it! | Go to your orders and start the return Select the ship method Ship it! | Create a magical story time experience for your child with moonlit 3-story reels bundle! Add tales about pirates, Dragons and a T-Rex to your Moonlite collection and introduce your little boy to exciting, adventure-filled stories he'll love! With the award-winning Moonlite storybook projector for your smartphone (sold separately) and the story reels included in this set, Enjoy reading how to be a pirate, there was an old Dragon who swallowed a Knight and I'm a T.Rex! Clip the projector onto your smartphone or smart device (not included) and slide in a story reel. Use the free app to read along to beautiful projected illustrations and create a truly immersive reading experience with the in-app sound effects! As your child listens to these exciting stories, they'll develop their language skills, creativity and a love of reading and learning. Cozy up for story time with Moonlite and the history reels bundle! | 3.2 ounces (View shipping rates and policies)",3.2 ounces,"",https://images-na.ssl-images-amazon.com/images/I/51rUvw7zrtL.jpg|https://images-na.ssl-images-amazon.com/images/I/51MYg4EV2pL.jpg|https://images-na.ssl-images-amazon.com/images/I/51tNGkk%2BQSL.jpg|https://images-na.ssl-images-amazon.com/images/I/51EkeBHHZuL.jpg|https://images-na.ssl-images-amazon.com/images/I/51FGAr81NXL.jpg|https://images-na.ssl-images-amazon.com/images/I/511xp-dN1nL.jpg|https://images-na.ssl-images-amazon.com/images/I/B1HrN5Ag7JS.jpg|https://images-na.ssl-images-amazon.com/images/G/01/x-locale/common/transparent-pixel.jpg,"",,https://www.amazon.com/Moonlite-3-Story-Bundle-Storybook-Projector/dp/B07NPJNZ9T,,,,,,,Y,,
