Uniq Id,Product Name,Brand Name,Asin,Category,Upc Ean Code,List Price,Selling Price,Quantity,Model Number,About Product,Product Specification,Technical Details,Shipping Weight,Product Dimensions,Image,Variants,Sku,Product Url,Stock,Product Details,Dimensions,Color,Ingredients,Direction To Use,Is Amazon Seller,Size Quantity Variant,Product Description
ce9fd24e5a2b750d26c861da26ca283c,Domez My Hero Academia 4-Piece Bundle,,,Toys & Games | Toy Figures & Playsets | Action Figures,,,$19.99,,DMZ0579,"Make sure this fits by entering your model number. | 3.1” Domez feature character-authentic details and dynamic styling that collectors crave. | Each mystery 4-Pack includes 4 collectible characters, Each enclosed in their own stackable & connectable display case. | Nine styles available, including all might, izuku midoriya (deku), Katsuki Baku go, ochaco uraraka, Tenya iida, Shoto todoroki, tsuyu asui, shot a aizwa (eraser head) and a mystery Chase variant! | Suitable for ages 8 and up.",ProductDimensions:2x2x3inches|ItemWeight:6.2ounces|ShippingWeight:6.2ounces(Viewshippingratesandpolicies)|ASIN:B07Y91KCN8|Itemmodelnumber:DMZ0579|Manufacturerrecommendedage:8yearsandup,"Style:Series 1 show up to 2 reviews by default You can be a hero with My Hero Academia Domez Series 1, featuring characters from the smash-hit anime series! Each mystery 4-pack includes four out of nine possible characters, including all might, Izuku midoriya (Deke), Katsu Ki bakugo, ochaco uraraka, Tenya iida, shoot Todoroki, tsuyu asui, shot a AIZWA (eraser) and a mystery Chase variant! Each miniature figure is enclosed in their own stackable and connectable display case. Build your collection of Domez to connect & display—your way! For ages 8 and up. | 6.2 ounces (View shipping rates and policies)",6.2 ounces,,https://images-na.ssl-images-amazon.com/images/I/415Z5w-asgL.jpg|https://images-na.ssl-images-amazon.com/images/I/41aLMT9AvLL.jpg|https://images-na.ssl-images-amazon.com/images/I/31bgZ3YpQdL.jpg|https://images-na.ssl-images-amazon.com/images/I/31aWAznSuHL.jpg|https://images-na.ssl-images-amazon.com/images/I/31GJWayEoGL.jpg|https://images-na.ssl-images-amazon.com/images/I/41C8qkAJRuL.jpg|https://images-na.ssl-images-amazon.com/images/I/31RWZGioiVL.jpg|https://images-na.ssl-images-amazon.com/images/G/01/x-locale/common/transparent-pixel.jpg,"",,https://www.amazon.com/Domez-Hero-Academia-4-Piece-Bundle/dp/B07Y91KCN8,,,,,,,Y,,
ee4f7424fcbf4e3767bd0018e4c3e1d3,"Paw Patrol, Mighty Pups Charged Up Chase’s Deluxe Vehicle with Lights and Sounds",,,Toys & Games | Baby & Toddler Toys,"",,$14.99,,6058005,"Make sure this fits by entering your model number. | VEHICLE WITH LIGHTS AND SOUNDS: Chase’s cruiser features lights and sounds and caster wheels that make it possible to drive in any direction! Push the button to activate the lights and sounds! | HOVERCRAFT MODE: With working caster wheels, it’s easier than ever to roll your Charged Up Deluxe Vehicle to the rescue. Spin and drift 360 degrees in any direction and help save the day! | INCLUDES CHASE FIGURE: Wearing his blue Charged Up uniform, place the included Chase collectible figure behind the wheel of his deluxe cruiser. This pup hero is ready for anything that comes his way! | The PAW Patrol Charged Up Chase Deluxe Vehicle makes a great gift for kids aged 3 and up. Requires 3 LR44 batteries (included). Get charged up with PAW Patrol and their Deluxe Vehicles! | Includes: 1 Chase Figure, 1 Charged Up Deluxe Chase Vehicle",ProductDimensions:3.8x8x6.5inches|ItemWeight:12ounces|ShippingWeight:12ounces(Viewshippingratesandpolicies)|ASIN:B07WHLYW7F|Itemmodelnumber:6058005|Manufacturerrecommendedage:36months-5years,"Mighty Chase is charged up and ready for action in his Charged Up Deluxe Vehicle! With Chase (figure included) behind the wheel of his cruiser, it’s time for action-packed mighty rescues! Chase’s Charged Up Deluxe Vehicle is equipped with lights and sounds and real working caster wheels that make it possible to drift 360 degrees in any direction! Push the button on the front of the cruiser to activate the lights and sounds – translucent accents on the vehicle light up as it makes exciting sound effects! Collect the rest of the Charged Up Deluxe Vehicles (each sold separately) and team up to help save the day! Join Chase on supercharged rescue missions with his Charged Up Deluxe Vehicle! | 12 ounces (View shipping rates and policies)",12 ounces,"",https://images-na.ssl-images-amazon.com/images/I/41mzdeHA09L.jpg|https://images-na.ssl-images-amazon.com/images/I/514JQcGWPNL.jpg|https://images-na.ssl-images-amazon.com/images/I/41FE0zMn4VL.jpg|https://images-na.ssl-images-amazon.com/images/I/41zlXuYjOOL.jpg|https://images-na.ssl-images-amazon.com/images/I/51YJpBh2EnL.jpg|https://images-na.ssl-images-amazon.com/images/I/51VcG4Z1o-L.jpg|https://images-na.ssl-images-amazon.com/images/I/814RgjdsVbL.jpg|https://images-na.ssl-images-amazon.com/images/G/01/x-locale/common/transparent-pixel.jpg,"",,https://www.amazon.com/Paw-Patrol-Mighty-Charged-Vehicle/dp/B07WHLYW7F,,,,,,,Y,,
a837eca35fd596cd19b7c5601a1342bc,Alex Discover Button Art Activity Set Kids Art and Craft Activity,,,Toys & Games | Baby & Toddler Toys | Sorting & Stacking Toys,"",,$11.42,,1408,"Make sure this fits by entering your model number. | Match and snap to complete the picture | Develops hand eye coordination, fine motor skills and creative thinking | Convenient storage tray holds all pieces | Includes 46 colorful buttons, 10 different pictures and a 2 Piece storage tray | Recommended for children 18 months of age and older",ProductDimensions:12x12x12.2inches|ItemWeight:15.2ounces|ShippingWeight:1.54pounds(Viewshippingratesandpolicies)|DomesticShipping:ItemcanbeshippedwithinU.S.|InternationalShipping:ThisitemcanbeshippedtoselectcountriesoutsideoftheU.S.LearnMore|ASIN:B003AP4JPE|Itemmodelnumber:1408|Manufacturerrecommendedage:18monthsandup,"show up to 2 reviews by default ALEX Discover Button Art comes with over 40 buttons and 10 pictures for hours of artistic fun. This toy is designed for preschoolers to develop hand eye coordination, fine motor skills and creative thinking. It also comes with a wide storage tray to keep everything together. All your child has to do is match and snap the chunky buttons to complete the pictures. The pictures include a frog, bird, house, tree, truck, and more, all perfect for little ones learning how to use their creativity. Pick everything up and place back into the wide storage tray for a fast and easy cleanup. Includes 46 colorful buttons, 10 different pictures and a 2 piece storage tray. Recommended for children 18 months of age and older. | 1.54 pounds (View shipping rates and policies)",1.54 pounds,"",https://images-na.ssl-images-amazon.com/images/I/51n0cTKvgWL.jpg|https://images-na.ssl-images-amazon.com/images/I/51aAoqC2NGL.jpg|https://images-na.ssl-images-amazon.com/images/I/512Ri%2BS3PLL.jpg|https://images-na.ssl-images-amazon.com/images/I/51tPCCW981L.jpg|https://images-na.ssl-images-amazon.com/images/I/61TZcV9P0ZL.jpg|https://images-na.ssl-images-amazon.com/images/G/01/x-locale/common/transparent-pixel.jpg,"",,https://www.amazon.com/ALEX-Discover-Button-Art-Activity/dp/B003AP4JPE,,,,,,,Y,,
b4358a38037a7e7fbcd7fe16970e7bff,DC Collectibles DCTV: Black Lightning Resin Statue,,,"Toys & Games | Collectible Toys | Statues, Bobbleheads & Busts | Statues",,,$17.75,,DEC170420,"Make sure this fits by entering your model number. | From the upcoming DCTV series on The CW | Limited Edition of 5,000 | Measures approximately 12.42"" tall | Sculpted by Alterton",ProductDimensions:3x3x12.4inches|ItemWeight:2pounds|ShippingWeight:3.7pounds(Viewshippingratesandpolicies)|DomesticShipping:ItemcanbeshippedwithinU.S.|InternationalShipping:ThisitemcanbeshippedtoselectcountriesoutsideoftheU.S.LearnMore|ASIN:B077SCH3B2|Itemmodelnumber:DEC170420|Manufacturerrecommendedage:15yearsandup,"show up to 2 reviews by default Jefferson Pierce returns to the superhero fold as Black Lightning, the star of The CW's upcoming TV series Black Lightning! Limited edition of 5,000. Measures approximately 12.42"" tall. Sculpted by Alterton. | 3.7 pounds (View shipping rates and policies)",3.7 pounds,,https://images-na.ssl-images-amazon.com/images/I/41vJ5amvKeL.jpg|https://images-na.ssl-images-amazon.com/images/I/31tr4qwqZmL.jpg|https://images-na.ssl-images-amazon.com/images/I/31-%2BMGqJASL.jpg|https://images-na.ssl-images-amazon.com/images/I/31sgD4%2B0HlL.jpg|https://images-na.ssl-images-amazon.com/images/I/51HbaURPW8L.jpg|https://images-na.ssl-images-amazon.com/images/G/01/x-locale/common/transparent-pixel.jpg,"",,https://www.amazon.com/DC-Collectibles-DCTV-Lightning-Statue/dp/B077SCH3B2,,,,,,,Y,,
83e5bb2c78aa73a08f2363e66fcd9e1b,Rubie's Adult 2-Tone Costume Wig,,,"Clothing, Shoes & Jewelry | Costumes & Accessories | Women | Wigs",,,$14.73,,"",100% Polyester | Imported | Hand Wash | Costume wig crafted of synthetic fibers | Super curly pink and blue hairpiece | One size fits most adults and older teens | For best results spritz and style wig before wearing | Rubie's costume company has been bringing costumes and accessories to the world since 1950,"",Go to Your Orders to start the return Print the return shipping label Ship it! | Go to Your Orders to start the return Print the return shipping label Ship it! | show up to 2 reviews by default BLACK AND RED STREAKED WIGVampire Costumes(Item #WIG431)Includeswig Two Tone Streak Wig in Black and Red. Be sure to get a wig cap to control hair under the wig. It improves the wig fit for better style and enhances wig comfort,"","",https://images-na.ssl-images-amazon.com/images/I/41Kn5kgGcDL.jpg|https://images-na.ssl-images-amazon.com/images/G/01/x-locale/common/transparent-pixel.jpg,https://www.amazon.com/Rubies-Pastel-Cotton-Candy-Curly/dp/B003Z9LCAK|https://www.amazon.com/Rubies-Pastel-Cotton-Candy-Curly/dp/B0046RTQQ2|https://www.amazon.com/Rubies-Pastel-Cotton-Candy-Curly/dp/B007XT0NTY|https://www.amazon.com/Rubies-Pastel-Cotton-Candy-Curly/dp/B001QJKRDY|https://www.amazon.com/Rubies-Pastel-Cotton-Candy-Curly/dp/B007XT0MOA|https://www.amazon.com/Rubies-Pastel-Cotton-Candy-Curly/dp/B00E1PWBNO|https://www.amazon.com/Rubies-Pastel-Cotton-Candy-Curly/dp/B00C0PE8L0,,https://www.amazon.com/Rubies-Pastel-Cotton-Candy-Curly/dp/B00C0PE8L0,,,,,,,Y,,
ca1066833c4acdb86c6f8d1e151d651e,Funko Pop! Rides: Mulan - Mulan On Khan,,,Toys & Games | Toy Figures & Playsets | Action Figures,,,$28.74,,45324,"Make sure this fits by entering your model number. | From Mulan, Mulan on Khan, as a stylized POP Rides from Funko! | Stylized collectable stands 5 inches tall, perfect for any Mulan fan! | Collect and display all Mulan pop! Vinyl's!",ProductDimensions:3x4x5inches|ItemWeight:8.2ounces|ShippingWeight:8ounces(Viewshippingratesandpolicies)|ASIN:B07W45KR12|Itemmodelnumber:45324|Manufacturerrecommendedage:6yearsandup,"Go to your orders and start the return Select the ship method Ship it! | Go to your orders and start the return Select the ship method Ship it! | show up to 2 reviews by default From Mulan, Mulan on Khan, as a stylized POP! Rides from Funko! Figure stands 5 inches and comes in a window display box. Check out the other Mulan figures from Funko! Collect them all! | 8 ounces (View shipping rates and policies)",8 ounces,"",https://images-na.ssl-images-amazon.com/images/I/41UEjHYEc9L.jpg|https://images-na.ssl-images-amazon.com/images/G/01/x-locale/common/transparent-pixel.jpg,"",,https://www.amazon.com/Funko-Pop-Rides-Mulan-Khan/dp/B07W45KR12,,,,,,,Y,,
88f6235d5f16bcaf83a9fd886bfdd565,Flaghouse Chrome Bowling Ball Ramp,,,"","",,$114.57,,9972,Make sure this fits by entering your model number. | Perfect for students in wheel chairs | Lightweight and easy to move around | Rubber feet on legs keeps the ramp in place when a student is using it,Product Dimensions:         62 x 26 x 25 inches    |Shipping Weight: 8.8 pounds (View shipping rates and policies)|Domestic Shipping: Item can be shipped within U.S.|International Shipping: This item can be shipped to select countries outside of the U.S.  Learn More|Shipping Advisory: This item must be shipped separately from other items in your order.  Additional shipping charges will not apply.|ASIN: B007Y76T3O|Item model number: 9972|    #51263    in Pre-Kindergarten Toys,Go to your orders and start the return Select the ship method Ship it! | Go to your orders and start the return Select the ship method Ship it! | show up to 2 reviews by default Product Description The Free Standing Bowling Ramp allows every student the chance to participate in bowling games. This ramp is perfect for students in wheel chairs. It is built of strong steel pipe and finished in chip-resistant bright chome. The ramp is lightweight and easy to move around and disassembles quickly and easily. Features rubber feet on the legs to help keep the ramp in place when a student is using it. From the Manufacturer The Free Standing Bowling Ramp allows every student the chance to participate in your bowling unit. This ramp is perfect for students in wheel chairs. The ramp is lightweight and easy to move around. Features rubber feet on the legs to help keep the ramp in place when a student is using it.,8.8 pounds,62 x 26 x 25 inches,https://images-na.ssl-images-amazon.com/images/I/51en-fIzrZL.jpg|https://images-na.ssl-images-amazon.com/images/I/51%2BDKfCi%2B8L.jpg|https://images-na.ssl-images-amazon.com/images/I/41lJ5ulb1YL.jpg|https://images-na.ssl-images-amazon.com/images/G/01/x-locale/common/transparent-pixel.jpg,"",,https://www.amazon.com/Flaghouse-Chrome-Bowling-Ball-Ramp/dp/B007Y76T3O,,,,,,,Y,,
37ec1604ef5bdfaaafd75a1bbaf5ec91,"Trends International DC Comics Movie-Batman v Superman Wall Poster, 14.725"" x 22.375"", Premium Unframed",,,Toys & Games | Toy Figures & Playsets | Action Figures,"",,$17.49,,POD14611S,Make sure this fits by entering your model number. | Prints within 24 Hours for immediate shipping | Printed on Premium 210 GSM Photo Art Gloss Paper | Officially Licensed Poster | FSC Certified Paper | Ready to Frame,ProductDimensions:22.4x14.7x0.1inches|ItemWeight:0.48ounces|ShippingWeight:0.48ounces(Viewshippingratesandpolicies)|Manufacturer:TrendsInternational|ASIN:B07ZGDW3L5|Itemmodelnumber:POD14611S,"Size:14.725"" x 22.375""  |  Color:Premium Unframed Express yourself with this full-colour, high-quality poster. Our posters are a great way to enhance any room—from a dorm room to a boardroom. They are easily framed or hung with our Poster Clip to make decorating any wall easy. Rolled and shipped in a steady tube. Makes a great gift! | 0.48 ounces (View shipping rates and policies)",0.48 ounces,"",https://images-na.ssl-images-amazon.com/images/I/41k0qqZyyeL.jpg|https://images-na.ssl-images-amazon.com/images/I/51CJs1F%2BDtL.jpg|https://images-na.ssl-images-amazon.com/images/I/517N3XyHxDL.jpg|https://images-na.ssl-images-amazon.com/images/G/01/x-locale/common/transparent-pixel.jpg,https://www.amazon.com/Trends-International-Movie-Batman-Superman-Unframed/dp/B07ZGDW3L5|https://www.amazon.com/Trends-International-Movie-Batman-Superman-Unframed/dp/B078C7RGC5|https://www.amazon.com/Trends-International-Movie-Batman-Superman-Unframed/dp/B07ZGGQ6JG|https://www.amazon.com/Trends-International-Movie-Batman-Superman-Unframed/dp/B07ZGGR57G|https://www.amazon.com/Trends-International-Movie-Batman-Superman-Unframed/dp/B07ZGGR57K|https://www.amazon.com/Trends-International-Movie-Batman-Superman-Unframed/dp/B07ZGDH16Z|https://www.amazon.com/Trends-International-Movie-Batman-Superman-Unframed/dp/B07ZGDW3L5|https://www.amazon.com/Trends-International-Movie-Batman-Superman-Unframed/dp/B07ZGGV4KN|https://www.amazon.com/Trends-International-Movie-Batman-Superman-Unframed/dp/B07ZGGZMX8,,https://www.amazon.com/Trends-International-Movie-Batman-Superman-Unframed/dp/B07ZGDW3L5,,,,,,,Y,,
a7a21a6b83ba70d2910c44d73b6b7725,"Aurora World Sweet and Softer Perky Penguin 9.5"" Plush",,,Toys & Games | Stuffed Animals & Plush Toys | Stuffed Animals & Teddy Bears,"",,$12.29,,03395,"Make sure this fits by entering your model number. | 9.5"" overall height, standing position | Silky soft two-tone plush that is sweet to the touch | Made with high quality materials and lock washer eyes for safety | country of origin:China and Indonesia",ProductDimensions:6x6x10inches|ItemWeight:8ounces|ShippingWeight:10.4ounces(Viewshippingratesandpolicies)|DomesticShipping:ItemcanbeshippedwithinU.S.|InternationalShipping:ThisitemcanbeshippedtoselectcountriesoutsideoftheU.S.LearnMore|ASIN:B00B4WJB26|Itemmodelnumber:03395|Manufacturerrecommendedage:36months-15years|Batteries:1Lithiumionbatteriesrequired.,"Go to your orders and start the return Select the ship method Ship it! | Go to your orders and start the return Select the ship method Ship it! | Style:perky show up to 2 reviews by default Product Description 9.5"" PERKY PENGUIN Silky soft and sweet to the touch! Part of the Sweet and Softer Collection. From the Manufacturer Aurora World's Sweet and Softer Perky Penguin is 9.5"" tall and made of silky soft two-tone plush. Sweet and Softer characters are constructed with top quality materials and lock washer eyes for safety, ensuring durability and long time enjoyment. Aurora World is an industry leader with over 30 years of experience designing and manufacturing innovative, high quality plush products. | 10.4 ounces (View shipping rates and policies)",10.4 ounces,"",https://images-na.ssl-images-amazon.com/images/I/51zEr1BhvpL.jpg|https://images-na.ssl-images-amazon.com/images/I/51-uVCBgWbL.jpg|https://images-na.ssl-images-amazon.com/images/G/01/x-locale/common/transparent-pixel.jpg,https://www.amazon.com/Aurora-World-Sweet-Softer-Penguin/dp/B07V25VDZ3|https://www.amazon.com/Aurora-World-Sweet-Softer-Penguin/dp/B00B4WJB26,,https://www.amazon.com/Aurora-World-Sweet-Softer-Penguin/dp/B00B4WJB26,,,,,,,Y,,
18bf3174cb5fcba9e72702c927019cb3,Baby Alive Luv 'n Snuggle Baby Doll Blond,,,Toys & Games | Dolls & Accessories | Dolls,,,$9.27,,A5841223,"Make sure this fits by entering your model number. | Have the fun of real babies with the Luv 'n Snuggle Baby doll | Doll's thumb goes in her mouth, just like a real baby | Ages over 18 months and up | Includes doll and bottle",ProductDimensions:5x12x6inches|ItemWeight:14.4ounces|ShippingWeight:14.4ounces(Viewshippingratesandpolicies)|DomesticShipping:ItemcanbeshippedwithinU.S.|InternationalShipping:ThisitemcanbeshippedtoselectcountriesoutsideoftheU.S.LearnMore|ASIN:B00RGGGCCQ|Itemmodelnumber:A5841223|Manufacturerrecommendedage:18monthsandup,"Go to your orders and start the return Select the ship method Ship it! | Go to your orders and start the return Select the ship method Ship it! | Little girls can have the love and fun of real babies with this Luv 'n Snuggle Baby doll! She's a soft and cuddly little doll who needs your daughter to take care of her and cuddle her. She comes with a baby bottle for when she needs comfort and care. Her thumb goes in her mouth, just like a real baby! You'll love watching your little girl learn about being a mommy with the Luv 'n Snuggle Baby doll! Baby Alive and all related characters are trademarks of Hasbro. | 14.4 ounces (View shipping rates and policies)",14.4 ounces,,https://images-na.ssl-images-amazon.com/images/I/41wqBSDd2AL.jpg|https://images-na.ssl-images-amazon.com/images/I/51iRTfdtvuL.jpg|https://images-na.ssl-images-amazon.com/images/G/01/x-locale/common/transparent-pixel.jpg,"",,https://www.amazon.com/Baby-Alive-Snuggle-Doll-Blond/dp/B00RGGGCCQ,,,,,,,Y,,
27006457c5a1578ed9d45ff737055656,Mega Construx Welliewishers Playful Playhouse Buildable Playset,,,Toys & Games | Dolls & Accessories | Playsets,"",,$22.99,,FFC49,"Make sure this fits by entering your model number. | Easy-to-build Playhouse with interior rooms, and doors and windows that open | Easy-to-build garden tree with birdhouse, fence, birdfeeder, and two robins | Easy-to-build art station with paint easel, tree stump seat, and paint accessories | Two buildable, highly detailed, poseable mini figures, Willa and Kendall, each in their signature outfit and wellies | Accessories include buildable wagon that rolls, two kites, gardening tools, bush, and flowers",ProductDimensions:2.3x12.8x10.3inches|ItemWeight:15.2ounces|ShippingWeight:1.05pounds(Viewshippingratesandpolicies)|DomesticShipping:ItemcanbeshippedwithinU.S.|InternationalShipping:ThisitemcanbeshippedtoselectcountriesoutsideoftheU.S.LearnMore|ASIN:B01N5QY3A1|Itemmodelnumber:FFC49|Manufacturerrecommendedage:6-10years,"Create and build in the WellieWishers' favorite place to play make-believe! When it comes to play time, there's no stopping Willa and Kendall's imagination in the Playful Playhouse. Build the playhouse and set their cutest ideas into motion! Fly the Wellies' kites with their robin friends. Help Willa paint at the easel. Get Kendall's tools from her bench and use them to build a birdhouse. No matter what they do, this is where the WellieWishers make friendships bloom! Ideal for ages 5 and up. | 1.05 pounds (View shipping rates and policies)",1.05 pounds,"",https://images-na.ssl-images-amazon.com/images/I/51mrb%2BpfB-L.jpg|https://images-na.ssl-images-amazon.com/images/I/61ZfWZ6oIQL.jpg|https://images-na.ssl-images-amazon.com/images/I/51WW52wv53L.jpg|https://images-na.ssl-images-amazon.com/images/I/413YJqQonNL.jpg|https://images-na.ssl-images-amazon.com/images/I/416g6iO8arL.jpg|https://images-na.ssl-images-amazon.com/images/I/518Fl2hradL.jpg|https://images-na.ssl-images-amazon.com/images/I/51csCM4XWAL.jpg|https://images-na.ssl-images-amazon.com/images/G/01/x-locale/common/transparent-pixel.jpg,"",,https://www.amazon.com/Mega-Construx-Welliewishers-Playhouse-Buildable/dp/B01N5QY3A1,,,,,,,Y,,
b2c24314887c92d7464a191f3c54de52,Aurora World Miyoni Poodle Pup Plush,,,Toys & Games | Stuffed Animals & Plush Toys | Stuffed Animals & Teddy Bears,,,$14.41,,26276,"Make sure this fits by entering your model number. | Measures 9"" long | Authentic Miyoni plush animals have realistic styling, made with superior materials and impeccable attention to detail | Silky plush and soft huggable bodies",ProductDimensions:5.5x9x7inches|ItemWeight:5.6ounces|ShippingWeight:5.6ounces(Viewshippingratesandpolicies)|DomesticShipping:ItemcanbeshippedwithinU.S.|InternationalShipping:ThisitemcanbeshippedtoselectcountriesoutsideoftheU.S.LearnMore|ASIN:B01BKUF2WE|Itemmodelnumber:26276|Manufacturerrecommendedage:36months-15years,"Go to your orders and start the return Select the ship method Ship it! | Go to your orders and start the return Select the ship method Ship it! | show up to 2 reviews by default Aurora World's Miyoni premium plush animals are made with superior materials and great attention to detail. Each piece is beautifully designed and features realistic air-brushed color accents to replicate the animals as found in nature. Double bagged bean-filling along with lock-washer eyes and nose ensure safety and durability, giving long lasting enjoyment. Aurora World is an industry leader with over 30 years of experience designing and manufacturing innovative, high quality plush products. | 5.6 ounces (View shipping rates and policies)",5.6 ounces,"",https://images-na.ssl-images-amazon.com/images/I/51y8vchBQeL.jpg|https://images-na.ssl-images-amazon.com/images/I/51a4ssVGjYL.jpg|https://images-na.ssl-images-amazon.com/images/I/51T6EpUCMGL.jpg|https://images-na.ssl-images-amazon.com/images/G/01/x-locale/common/transparent-pixel.jpg,"",,https://www.amazon.com/Aurora-World-Miyoni-Poodle-Plush/dp/B01BKUF2WE,,,,,,,Y,,
7b3118bcb208e06362ff2eb42d5b9b3c,"Squish-Dee-Lish Squishy Jumbo Toy, Squishies - Slow Rising Pup-Corn, Soft Kids Squishy Toys 86715",,,Toys & Games | Novelty & Gag Toys | Miniatures,"",,$4.30,,B07GTGHV1M,"Make sure this fits by entering your model number. | Jumbo size squishy toys for more squishing fun! | Super slow-rise foam | Perfect for hours of squeezing fun | Approximately 7,"" comes in gusseted bag. | This is a toy. Not real food. Warning: Choking Hazard - Small parts. Not for children under 3 years. For ages 6+",ProductDimensions:6.2x6.2x9.8inches|ItemWeight:11.2ounces|ShippingWeight:11.2ounces(Viewshippingratesandpolicies)|ASIN:B07GTGHV1M|Itemmodelnumber:B07GTGHV1M|Manufacturerrecommendedage:6-9years,"Squish-Dee-Lish are super cute slow-rise foam squishy toys that are fun to squeeze and super soft. Squish-Dee-Lish are so adorable and fun to collect. Squish-Dee-Lish now come in Jumbo size for more squishing fun!! These super slow-rise jumbo squishies come in 6 adorable styles like Pup-corn, Cat-puccino, Bunn-Ana, Mama & Baby Koala, Guinea Pig and Penguin. Fun Animal/Food Mash-ups as well as Mamas and Baby designs. Collect them all! (Each sold separately). Each one is approx. 7""H. This is a toy. Not real food. Warning: Choking Hazard - Small parts. Not for children under 3 years. For ages 6+ | 11.2 ounces (View shipping rates and policies)",11.2 ounces,"",https://images-na.ssl-images-amazon.com/images/I/512PubE6lhL.jpg|https://images-na.ssl-images-amazon.com/images/I/419IG%2BcmiYL.jpg|https://images-na.ssl-images-amazon.com/images/I/41kHMM8ISDL.jpg|https://images-na.ssl-images-amazon.com/images/I/41tMm7BJsKL.jpg|https://images-na.ssl-images-amazon.com/images/I/51nabBFEyvL.jpg|https://images-na.ssl-images-amazon.com/images/I/412Kma8g%2BTL.jpg|https://images-na.ssl-images-amazon.com/images/G/01/x-locale/common/transparent-pixel.jpg,"",,https://www.amazon.com/Squish-Dee-Lish-Squishy-Jumbo-Toy-Squishies/dp/B07GTGHV1M,,,,,,,Y,,
