Uniq Id,Product Name,Brand Name,Asin,Category,Upc Ean Code,List Price,Selling Price,Quantity,Model Number,About Product,Product Specification,Technical Details,Shipping Weight,Product Dimensions,Image,Variants,Sku,Product Url,Stock,Product Details,Dimensions,Color,Ingredients,Direction To Use,Is Amazon Seller,Size Quantity Variant,Product Description
af983053a35fa2a843092369ff3b400b,Peppa Pig Shape Sorter Clock Puzzle (12Piece),,,Toys & Games | Baby & Toddler Toys | Teaching Clocks,"",,$11.88,,68008,"Make sure this fits by entering your model number. | The removable, brightly colored wooden shapes with numbers printed beneath the shapes allow for greater interaction and ease of matching | With this shape sorter clock, learning to tell time is made fun and simple! | 12 die-cut wooden shapes, clock face labeled with hours and minutes, wooden clock stand and bright fun colors with smooth edges",ProductDimensions:0.9x8.5x8.5inches|ItemWeight:9.1ounces|ShippingWeight:11.2ounces(Viewshippingratesandpolicies)|DomesticShipping:ItemcanbeshippedwithinU.S.|InternationalShipping:ThisitemcanbeshippedtoselectcountriesoutsideoftheU.S.LearnMore|ASIN:B015EOHBKI|Itemmodelnumber:68008|Manufacturerrecommendedage:36months-4years,show up to 2 reviews by default Peppa Pig Shape Sorter Clock Puzzle (12Piece) | 11.2 ounces (View shipping rates and policies),11.2 ounces,"",https://images-na.ssl-images-amazon.com/images/I/519BaFjimBL.jpg|https://images-na.ssl-images-amazon.com/images/I/51vOIUMj0ML.jpg|https://images-na.ssl-images-amazon.com/images/I/51QRaxeSHcL.jpg|https://images-na.ssl-images-amazon.com/images/G/01/x-locale/common/transparent-pixel.jpg,"",,https://www.amazon.com/Peppa-Pig-Sorter-Puzzle-12Piece/dp/B015EOHBKI,,,,,,,Y,,
6d38858169064c8b7069a19c90dd0ae4,Huffy Kids Bikes 16 & 20 inch with Streamers and BMX Pegs,,,"Toys & Games | Tricycles, Scooters & Wagons | Balance Bikes",,,$74.99 - $249.99,,"","",Shipping Information: View shipping rates and policies|ASIN: B07QFG72PC|    #30    in Kids' Bicycles    |    #34    in Kids' Balance Bikes,"","","",https://images-na.ssl-images-amazon.com/images/I/41bejMzMMgL.jpg|https://images-na.ssl-images-amazon.com/images/I/51Q4WjgBiuL.jpg|https://images-na.ssl-images-amazon.com/images/I/51mF8EfCcdL.jpg|https://images-na.ssl-images-amazon.com/images/I/31sgrPSX7yL.jpg|https://images-na.ssl-images-amazon.com/images/I/51dodtvTrjL.jpg|https://images-na.ssl-images-amazon.com/images/I/41lLlFdRmwL.jpg|https://images-na.ssl-images-amazon.com/images/G/01/x-locale/common/transparent-pixel.jpg,https://www.amazon.com/Huffy-Boys-Thunder-16-Inch-Wheels/dp/|https://www.amazon.com/Huffy-Boys-Thunder-16-Inch-Wheels/dp/|https://www.amazon.com/Huffy-Boys-Thunder-16-Inch-Wheels/dp/B001JEPXUS|https://www.amazon.com/Huffy-Boys-Thunder-16-Inch-Wheels/dp/|https://www.amazon.com/Huffy-Boys-Thunder-16-Inch-Wheels/dp/|https://www.amazon.com/Huffy-Boys-Thunder-16-Inch-Wheels/dp/|https://www.amazon.com/Huffy-Boys-Thunder-16-Inch-Wheels/dp/|https://www.amazon.com/Huffy-Boys-Thunder-16-Inch-Wheels/dp/|https://www.amazon.com/Huffy-Boys-Thunder-16-Inch-Wheels/dp/|https://www.amazon.com/Huffy-Boys-Thunder-16-Inch-Wheels/dp/|https://www.amazon.com/Huffy-Boys-Thunder-16-Inch-Wheels/dp/|https://www.amazon.com/Huffy-Boys-Thunder-16-Inch-Wheels/dp/|https://www.amazon.com/Huffy-Boys-Thunder-16-Inch-Wheels/dp/|https://www.amazon.com/Huffy-Boys-Thunder-16-Inch-Wheels/dp/B001JEPXUS,,https://www.amazon.com/Huffy-Boys-Thunder-16-Inch-Wheels/dp/B001JEPXUS,,,,,,,Y,,
326ebcfaa8d5204b634b5648e88e2fe4,NKOK Sonic and Sega All Stars Racing Remote Controlled Car - Sonic The Hedgehog,,,Toys & Games | Kids' Electronics,,,$26.99,,RC-611,Make sure this fits by entering your model number. | Requires 6AA batteries (not included) | This product was awarded the Fun Stuff award by Parents' Choice Foundation | For Ages 6 and Up | Official sonic product | Full function radio control | Requires 6 AA batteries (not included) | Limited availability | New and sealed inside retail packaging,ProductDimensions:7x4x3inches|ItemWeight:2.2pounds|ShippingWeight:1.23pounds(Viewshippingratesandpolicies)|DomesticShipping:ItemcanbeshippedwithinU.S.|InternationalShipping:ThisitemcanbeshippedtoselectcountriesoutsideoftheU.S.LearnMore|ASIN:B003SUW37W|Itemmodelnumber:RC-611|Manufacturerrecommendedage:6-13years|Batteries:6AAbatteriesrequired.,"Product Description Sonic is a video game legend and features some of the most recognizable characters in gaming history! Sonic is the world’s fastest Hedgehog. Capable of running at the speed of sound (768mph)! “Super Sonic” transformation is indestructible! He drives the Speed Star built by Tails! From the Manufacturer Sonic is the world's fastest hedgehog, capable of running at the speed of sound (768 mph). His other abilities include a ""Spin Attack"", a ""Spin Dash"" and his ""Super Sonic"" transformation which makes him indestructible and gives him the gift of run flight. Sonic is not an expert swimmer, but is fearless even of Dr. Eggman. Alongside his best friend tails, Sonic runs around the world stopping Dr. Eggman's schemes. He drives the speed star a car built by his friend tails it helps to make a fair race as no one can beat sonic on foot. | 1.23 pounds (View shipping rates and policies)",1.23 pounds,"",https://images-na.ssl-images-amazon.com/images/I/51M1sShThFL.jpg|https://images-na.ssl-images-amazon.com/images/I/410BRNy1DyL.jpg|https://images-na.ssl-images-amazon.com/images/I/41qE7aAEXPL.jpg|https://images-na.ssl-images-amazon.com/images/I/31dPZVJqwRL.jpg|https://images-na.ssl-images-amazon.com/images/G/01/x-locale/common/transparent-pixel.jpg,"",,https://www.amazon.com/NKOK-Sonic-Racing-Remote-Controlled/dp/B003SUW37W,,,,,,,Y,,
a11d9462309527143094a0f68bce0a58,Industro Stainless Steel Hose Clamps,,,Home & Kitchen | Home Décor | Kids' Room Décor,,,$34.27,,193,"Make sure this fits by entering your model number. | Rectangular perforations help to hold strong and connect easily. Color: Silver. | Tub makes for easy storage. Product Dimension: 2""D x 0. 6""H x 2""W | Size: 1-3/4"", Size range: 3/4"" to 1-3/4"", Finish: Stainless Steel. | AISI 300 series stainless steel material. | Corrosion resistant. : 1 year.",ProductDimensions:2x0.6x2inches|ItemWeight:1.37pounds|ShippingWeight:1.37pounds(Viewshippingratesandpolicies)|Manufacturer:IndustroIntl|ASIN:B07M9BPMTK|Itemmodelnumber:193,"Go to your orders and start the return Select the ship method Ship it! | Go to your orders and start the return Select the ship method Ship it! | show up to 2 reviews by default 300 AIS high quality 1-3/4"" Stainless-Steel Clamp. The clamp fits 3/4"" to 1-3/4"" Dia hoses and is constructed from durable stainless-steel. The bands have punched rectangular perforations that help hold strong and connect easily. Maximum hose size compatibility: 1. 75"", Minimum hose size compatibility: 0. 75"", Maintenance, Repair & Supplies Product Type: Repair Clamps. Repair Clamps Type: For Hoses. | 1.37 pounds (View shipping rates and policies)",1.37 pounds,"",https://images-na.ssl-images-amazon.com/images/I/41y%2BKv5LLzL.jpg|https://images-na.ssl-images-amazon.com/images/I/319j8eJEtNL.jpg|https://images-na.ssl-images-amazon.com/images/G/01/x-locale/common/transparent-pixel.jpg,"",,https://www.amazon.com/Industro-Stainless-Steel-Hose-Clamps/dp/B07M9BPMTK,,,,,,,Y,,
fdd8daf07ddd4a23832f3da7d209252f,"Oopsy Daisy Birchwood Owl Growth Chart, Pink, 12"" x 42""",,,Baby Products | Nursery | Décor | Wall Décor | Growth Charts,"",,$18.70,,NB19671,Art by Jen Christopher | Color-coordinated decorative covers are supplied that fit over the screw or nail to create a finished look | Grommets are placed in the corners to make hanging easy | Ideal gift for baby showers and first birthdays | Easy to store - just roll up each height chart as a treasured keepsake,"","Go to Your Orders to start the return Print the return shipping label Ship it! | Go to Your Orders to start the return Print the return shipping label Ship it! | This personalized growth chart is perfect for the gal who likes clean, crisp color palettes. It will remain a lovely accent as your decor changes and your little one grows. One day, your height chart can be a treasured keepsake full of fond memories.",13.6 ounces,"",https://images-na.ssl-images-amazon.com/images/I/31B3hyqqWAL.jpg|https://images-na.ssl-images-amazon.com/images/I/41SjEJ1%2B-6L.jpg|https://images-na.ssl-images-amazon.com/images/I/51HESzXLyqL.jpg|https://images-na.ssl-images-amazon.com/images/I/41%2BTcyn0oKL.jpg|https://images-na.ssl-images-amazon.com/images/I/51r8Uk%2Bf1tL.jpg|https://images-na.ssl-images-amazon.com/images/I/511NoA3bRQL.jpg|https://images-na.ssl-images-amazon.com/images/I/3168ZmkMkZL.jpg|https://images-na.ssl-images-amazon.com/images/G/01/x-locale/common/transparent-pixel.jpg,"",,https://www.amazon.com/Oopsy-Daisy-Birchwood-Growth-Chart/dp/B00LA48EP8,,,,,,,Y,,
c15e7efbe14b9bbcb8b7fe31f9818021,Springbok Puzzles - Christmas Wishes - 400 Piece Jigsaw Puzzle - Large 26.75 Inches by 20.5 Inches Puzzle - Made in USA - Unique Cut Interlocking Pieces - Big Pieces for Kids & Small Pieces for Adults,,,Toys & Games | Puzzles | Jigsaw Puzzles,"",,$14.95,,34-70549,"Make sure this fits by entering your model number. | 400 PIECE JIGSAW PUZZLE - Featuring a finished size of 26.75 inches by 20.5 inches with a precision cut that ensures a tight, interlocking heirloom-quality puzzle | MADE IN USA - Manufactured in Kansas City, Missouri; Springbok Puzzles have been American made since 1963 | ECO-FRIENDLY - Springbok Puzzles are manufactured with sustainably sourced organic, non-toxic soy-based inks & utilizes 100% recycled puzzle board materials | UNIQUE CUT PIECES - Each puzzle piece is unique and never repeated; Springbok Puzzle pieces are made from thick cut 75 point board, 18% thicker than the industry average | EASY NO HASSLE PUZZLE WARRANTY - All Springbok Puzzle products are covered with our satisfaction guarantee on materials and craftsmanship",ProductDimensions:20.5x0x26.8inches|ItemWeight:1.5pounds|ShippingWeight:1.61pounds(Viewshippingratesandpolicies)|DomesticShipping:ItemcanbeshippedwithinU.S.|InternationalShipping:ThisitemcanbeshippedtoselectcountriesoutsideoftheU.S.LearnMore|ASIN:B071GRMV63|Itemmodelnumber:34-70549|Manufacturerrecommendedage:36months-15years,"Size:400 Piece Puzzle Springbok Christmas Wishes 400 Piece Jigsaw Puzzle Snuggle up next to the fire with ""Christmas Wishes."" This 400 piece jigsaw puzzle is an adorable illustration of a puppy deep in dreamland waiting for Santa to bring him a gift. Springbok has been a leading name in the puzzle world since 1963. We have focused on the qualities that give Springbok its reputation: originality, innovation and superior quality. As one of the few puzzle manufacturers that makes puzzles exclusively in the U.S.A., we take pride in the superior quality of our puzzles. The quality of our dies and above average thickness of our chipboards ensures the interlocking pieces will come together flawlessly multiple times. As one of the only puzzle manufacturers to own patented puzzle dies, our products are always original. Whether it's our 400 piece Family Puzzles, or one of our stunning landscapes, no two puzzles, or pieces, are alike. Producing only 25 new puzzles a year is one of the ways we guarantee that our new puzzles do not fall short of the exacting Springbok standards. Materials: Recycled Chip Board & Organic Soy Based Ink Lithography. 400 Piece Jigsaw Puzzle - Featuring a finished size of 26.75 inches by 20.5 inches with a precision cut that ensures a tight, interlocking heirloom-quality puzzle Made in USA - Manufactured in Kansas City, Missouri; Springbok Puzzles have been American made since 1963 Nature-Friendly - Springbok Puzzles are manufactured with sustainably sourced organic, non-toxic soy-based inks & utilizes 100% recycled puzzle board materials Unique Cut Pieces - Each puzzle piece is unique and never repeated; Springbok Puzzle pieces are made from thick cut 75 point board, 18% thicker than the industry average Easy No Hassle Puzzle Warranty - All Springbok Puzzle products are covered with our satisfaction guarantee on materials and craftsmanship | 1.61 pounds (View shipping rates and policies)",1.61 pounds,"",https://images-na.ssl-images-amazon.com/images/I/518B%2BLjZbOL.jpg|https://images-na.ssl-images-amazon.com/images/I/514kzTP1M%2BL.jpg|https://images-na.ssl-images-amazon.com/images/I/51kGTNu1CmL.jpg|https://images-na.ssl-images-amazon.com/images/I/51UDOwMmdOL.jpg|https://images-na.ssl-images-amazon.com/images/I/51CdU8KL%2BxL.jpg|https://images-na.ssl-images-amazon.com/images/I/51TlzvJ4HHL.jpg|https://images-na.ssl-images-amazon.com/images/I/61dQuCGTN1L.jpg|https://images-na.ssl-images-amazon.com/images/G/01/x-locale/common/transparent-pixel.jpg,https://www.amazon.com/Springbok-Puzzles-Christmas-Wishes-Interlocking/dp/B07WCQWLYS|https://www.amazon.com/Springbok-Puzzles-Christmas-Wishes-Interlocking/dp/B071GRMV63,,https://www.amazon.com/Springbok-Puzzles-Christmas-Wishes-Interlocking/dp/B071GRMV63,,,,,,,Y,,
5bb4a9aa52085ada20006d166b1e2f87,Franklin Sports Eye Black Stickers for Kids - Customizable Lettering Baseball and Football Eye Black Stickers - White Pencil Included,,,Sports & Outdoors | Sports & Fitness | Team Sports,,,$6.91,,11392S11,"Make sure this fits by entering your model number. | EASY USE: Just peel and stick these eyeblack stickers under the eyes to use; This non toxic material is safe to use and will stay on as long as you need; No mistakes, no mess | FULLY CUSTOMIZABLE: Write anything you want on these eyeblack stickers to personalize them exactly to your liking | WHITE PENCIL INCLUDED: The special white pencil to write on your stickers is included in the set so you'll have everything you need | REDUCE GLARE: The eye black stickers will help reduce glare from the sun and bright lights so you can keep your eye on the ball | PERFECT FOR ALL AGES: These stickers are a great way for players young and old to reduce glare and add some style to their look","Product Dimensions:         0.4 x 4.2 x 6.2 inches    |Shipping Weight: 0.8 ounces (View shipping rates and policies)|Domestic Shipping: Currently, item can be shipped only within the U.S. and to APO/FPO addresses. For APO/FPO shipments, please check with the manufacturer regarding warranty and support issues.|International Shipping: This item can be shipped to select countries outside of the U.S.  Learn More|ASIN: B009Z2WXA4|Item model number: 11392S11|    #810    in Team Sports",Go to your orders and start the return Select the ship method Ship it! | Go to your orders and start the return Select the ship method Ship it! | Franklin Sports Eye Black Stickers are non-toxic and reduce the glare from the sun and the lights at night. These Eye Black Stickers include a special pencil to help customize your look. Made from non-toxic material.,0.8 ounces,0.4 x 4.2 x 6.2 inches,https://images-na.ssl-images-amazon.com/images/I/51CiVVrsClL.jpg|https://images-na.ssl-images-amazon.com/images/I/41qxTDiJDaL.jpg|https://images-na.ssl-images-amazon.com/images/I/51-DoCmbB1L.jpg|https://images-na.ssl-images-amazon.com/images/G/01/x-locale/common/transparent-pixel.jpg,https://www.amazon.com/Franklin-Sports-Eye-Black-Stickers/dp/B009Z2WXA4|https://www.amazon.com/Franklin-Sports-Eye-Black-Stickers/dp/B07FCM4RXY,,https://www.amazon.com/Franklin-Sports-Eye-Black-Stickers/dp/B009Z2WXA4,,,,,,,Y,,
2339c5be505bf647ebff669697c6bc25,Costume Sunglasses Clown from IT Sun-Staches Party Favors UV400,,,Toys & Games | Dress Up & Pretend Play | Costumes,,,$5.99,,SG3301,"Make sure this fits by entering your model number. | All Sun-Staches Sunglasses provide 100% UV400 protection and impact resistant lenses because we care! | Instant party starter and very comfortable to wear | Great for kids and adults, one size fits most | As seen on the popular show, Shark Tank | Officially licensed product",ProductDimensions:12x1x7inches|ItemWeight:3.2ounces|ShippingWeight:3.36ounces(Viewshippingratesandpolicies)|ASIN:B07GG8DFWD|Itemmodelnumber:SG3301|Manufacturerrecommendedage:3months-8years,"Color:Orange/Red Scare everyone in town with these IT Clown Sun-Staches! Sun-Staches provide 100% UV 400 protection and ultimate party fun. These one-size-fits-most sunglasses transform you into the star of the show; whether it’s a themed party, pop culture costume, or your favorite character. As seen on Shark Tank, these sunglasses are comfortable and perfect for adults and children of all ages! Sun-Staches can instantly transform anyone into the life of the party or the most interesting person at the supermarket. For the adults, it's the perfect way to bring out your inner kid-at-heart personality. For kids, it's a way to show off a favorite character or just have fun! Would you rather play a game of ultimate Frisbee with some boring guy without glasses or your neighbor who just happens to be wearing a leprechaun mask and having the time of their life? Our thoughts exactly. | 3.36 ounces (View shipping rates and policies)",3.36 ounces,,https://images-na.ssl-images-amazon.com/images/I/41UH2QoXb2L.jpg|https://images-na.ssl-images-amazon.com/images/I/41uc1vqLzYL.jpg|https://images-na.ssl-images-amazon.com/images/I/41LEOE0f8ZL.jpg|https://images-na.ssl-images-amazon.com/images/I/51EolpdzngL.jpg|https://images-na.ssl-images-amazon.com/images/G/01/x-locale/common/transparent-pixel.jpg,https://www.amazon.com/Costume-Sunglasses-Clown-Sun-Staches-Favors/dp/B07HB99CKB|https://www.amazon.com/Costume-Sunglasses-Clown-Sun-Staches-Favors/dp/B07GG8DFWD|https://www.amazon.com/Costume-Sunglasses-Clown-Sun-Staches-Favors/dp/B07GG66QWL|https://www.amazon.com/Costume-Sunglasses-Clown-Sun-Staches-Favors/dp/B07GG64PKT,,https://www.amazon.com/Costume-Sunglasses-Clown-Sun-Staches-Favors/dp/B07GG8DFWD,,,,,,,Y,,
93c659c89f9a1a81374c61c3fdf881bb,"Jay Franco Disney Frozen 2 Forest Spirit Twin/Full Comforter & Sham Set, Mutli",,,Home & Kitchen | Bedding | Kids' Bedding | Comforters & Sets | Comforter Sets,,,$36.37,,JF40350EPCD,"Make sure this fits by entering your model number. | 100% Polyester | PERFECT FIT & FUN DESIGN - Reversible twin/full sized comforter measures 72 inch x 86 inches and sham measures 24 inch x 20 inches. Add a touch of decorative enchantment to your room with our fashionable and super soft Disney Frozen 2 comforter. Colorful and magical design features your child’s favorite Disney sisters, Elsa and Anna. | HIGH QUALITY & EASY CARE - Keep your little one as cozy as can be! Frozen 2 comforter is super soft and great for all seasons. 100% brushed microfiber polyester allows for a comfortable night's sleep. Fade resistant and machine washable. To clean, machine wash cold. To dry, air/tumble dry on low. | GREAT GIFT – This Disney Frozen 2 comforter will make any child smile and will transform any bedroom, guest room, kids room, RV, or vacation home. Great gift for school or home. It rolls up for easy storage and travel. This only the comforter, sheet set is sold separately. | SHOP THE FROZEN 2 COLLECTION - Complete your bedroom with our other Disney Frozen 2 products - Coordinating bedding and accessories available (sold separately). | OUR FAMILY COMPANY - Our company is still small and family run. We take great pride in our products and our unsurpassed customer service. We know that our wonderful customers are the reason we are in business! We offer excellent quality, non-toxic products. With our coordinating Frozen 2 accessories, you can mix and match our high-quality and unique boy’s comforter sets, girl’s comforter sets, kids sheet sets, or kids pillows.","PackageDimensions:16.9x11.5x6.7inches|ItemWeight:4.23pounds|ShippingWeight:4.23pounds(Viewshippingratesandpolicies)|Manufacturer:JayFrancoandSons,Inc.|ASIN:B07V5JT7XP|Itemmodelnumber:JF40350EPCD","show up to 2 reviews by default Let it go! Go on a magical adventure this Disney Frozen 2 Forest Spirit twin/full comforter and sham set. Sure to keep you warm, this reversible comforter is stuffed with polyester fill for loft and cozy comfort. Quilt stitching holds fill in place and adds decorative flair. Durable polyester fill is soft, comfy and warm and holds its shape after multiple washings. Reversible design allows you to instantly change the look by simply flipping the comforter over. Twin/full comforter features your child's favorite Disney sisters, Elsa and Anna. Twin/full comforter measures 72"" x 86"" inches and sham measures 24"" x 30"" inches. This is just the comforter and sham only, additional bedding coordinates and sold separately. Easy care, machine washable. | 4.23 pounds (View shipping rates and policies)",4.23 pounds,"",https://images-na.ssl-images-amazon.com/images/I/41uqfIm8fZL.jpg|https://images-na.ssl-images-amazon.com/images/I/41M%2ByCtzg1L.jpg|https://images-na.ssl-images-amazon.com/images/I/41CMvKDE-xL.jpg|https://images-na.ssl-images-amazon.com/images/I/51DpcukS7pL.jpg|https://images-na.ssl-images-amazon.com/images/G/01/x-locale/common/transparent-pixel.jpg,"",,https://www.amazon.com/Jay-Franco-Disney-Frozen-Comforter/dp/B07V5JT7XP,,,,,,,Y,,
25a1fcc6db40f86566c5f2d902407b15,TAMASHII NATIONS Bandai S.H. Figuarts Captain America & Tamashii Effect Explosion Avengers: Infinity War Action Figure,,,Toys & Games | Toy Figures & Playsets | Action Figures,,,$60.87,,BAN27626,"Make sure this fits by entering your model number. | Battle damage detailing to his costume have been carefully replicated and a digitally colored head is included. | Product size: approx. 6.1"" | Package size: approx. 11.2x7. 5x5. 1 in",ProductDimensions:2x2x6inches|ItemWeight:1.45pounds|ShippingWeight:1.45pounds(Viewshippingratesandpolicies)|DomesticShipping:ItemcanbeshippedwithinU.S.|InternationalShipping:ThisitemcanbeshippedtoselectcountriesoutsideoftheU.S.LearnMore|ASIN:B07BK72H55|Itemmodelnumber:BAN27626|Manufacturerrecommendedage:13yearsandup,"show up to 2 reviews by default Donning a completely new sculpt, the Captain America (Avengers: infinity war Ver.) is joining the s.H.Figuarts series! battle damage detailing to his costume have been carefully replicated and a digitally colored head is included. Set includes interchangeable hand parts (2 left & 2 right), a new accessory, and explosion effects. | 1.45 pounds (View shipping rates and policies)",1.45 pounds,"",https://images-na.ssl-images-amazon.com/images/I/41pkph02FPL.jpg|https://images-na.ssl-images-amazon.com/images/I/51QDRpf6OzL.jpg|https://images-na.ssl-images-amazon.com/images/I/51UiFERSc4L.jpg|https://images-na.ssl-images-amazon.com/images/I/51nO%2BfhbOaL.jpg|https://images-na.ssl-images-amazon.com/images/I/41grtb6UbSL.jpg|https://images-na.ssl-images-amazon.com/images/I/510%2B8amlrnL.jpg|https://images-na.ssl-images-amazon.com/images/I/51NG1Fb-vOL.jpg|https://images-na.ssl-images-amazon.com/images/G/01/x-locale/common/transparent-pixel.jpg,"",,https://www.amazon.com/Tamashii-Nations-Figuarts-Explosion-Avengers/dp/B07BK72H55,,,,,,,N,,
171c7524e8cf032d08d1315f3a538345,"Forum Novelties Union Officer Child's Costume, Medium",,,"Clothing, Shoes & Jewelry | Costumes & Accessories | Kids & Baby | Boys | Costumes",,,$21.07,,69924,"Make sure this fits by entering your model number. | Union Officer child costume contains shirt coast with gold tone buttons and pants with decorative trim | READ BEFORE BUYING: Costumes are not the same sizing as clothing, read size chart, Q & A, and reviews to know the best size for your child | Medium fits children 46 to 53 Inch tall, up to 62 pounds | Hat and gun sold separately | Forum Novelties makes costumes and accessories for dress-up, stage performances, costume parties, Halloween and more","ProductDimensions:13x10x2inches|ItemWeight:8ounces|ShippingWeight:12.8ounces(Viewshippingratesandpolicies)|DomesticShipping:Currently,itemcanbeshippedonlywithintheU.S.andtoAPO/FPOaddresses.ForAPO/FPOshipments,pleasecheckwiththemanufacturerregardingwarrantyandsupportissues.|InternationalShipping:ThisitemcanbeshippedtoselectcountriesoutsideoftheU.S.LearnMore|ASIN:B00GD3F3QE|Itemmodelnumber:69924|Manufacturerrecommendedage:5-7years","Go to your orders and start the return Select the ship method Ship it! | Go to your orders and start the return Select the ship method Ship it! | Size:Medium  |  Color:One Color  |  Product Packaging:Standard Packaging show up to 2 reviews by default Relive one of the most important battles in American history in this Union Officer child costume! For more than 30 years, Forum Novelties has been a leader in the costume industry, as well as the joke, trick, magic and novelty gift item business. Forum offers over 8,000 items to choose from, ranging from baby costumes, to adult and plus-size costumes, to pet costumes. Look to Forum Novelties for all of your Halloween, luau, Christmas, Mardi Gras and St. Patrick's day supplies. From funny to frightening, Forum has it all! | 12.8 ounces (View shipping rates and policies)",12.8 ounces,"",https://images-na.ssl-images-amazon.com/images/I/314rdsW5WLL.jpg|https://images-na.ssl-images-amazon.com/images/I/413N%2BekN88L.jpg|https://images-na.ssl-images-amazon.com/images/I/51fUN4SzEkL.jpg|https://images-na.ssl-images-amazon.com/images/G/01/x-locale/common/transparent-pixel.jpg,https://www.amazon.com/Forum-Novelties-Officer-Childs-Costume/dp/B00BFW9C4W|https://www.amazon.com/Forum-Novelties-Officer-Childs-Costume/dp/B00GD3F3QE|https://www.amazon.com/Forum-Novelties-Officer-Childs-Costume/dp/B00BFWABGA,,https://www.amazon.com/Forum-Novelties-Officer-Childs-Costume/dp/B00GD3F3QE,,,,,,,Y,,
