Uniq Id,Product Name,Brand Name,Asin,Category,Upc Ean Code,List Price,Selling Price,Quantity,Model Number,About Product,Product Specification,Technical Details,Shipping Weight,Product Dimensions,Image,Variants,Sku,Product Url,Stock,Product Details,Dimensions,Color,Ingredients,Direction To Use,Is Amazon Seller,Size Quantity Variant,Product Description
a6c9ec0ff537edf9736f99b3ca993506,VTech Twist and Hug Koala Rattle,,,Toys & Games | Kids' Electronics | Electronic Learning Toys,,,$7.99,,80-513200,"Make sure this fits by entering your model number. | Press the twinkling heart button to trigger phrases about feelings, fun facts about the koala, silly sounds and entertaining music and songs | Your little one will be delighted when shaking the adorable koala, hearing playful sounds and short tunes | Twisting the koala's colorful textured ears develop motor skills and promote tactile stimulation | Easy-grasp textured handle is perfectly sized for little ones to hold and shake, plus it's great for on-the-go play | Intended for ages 3-24 months. Requires 1 AAA battery. Battery included for demo purposes only, new battery recommended for regular use",ProductDimensions:2.2x6.3x5.9inches|ItemWeight:5.1ounces|ShippingWeight:8.5ounces(Viewshippingratesandpolicies)|ASIN:B07GXMCWT5|Itemmodelnumber:80-513200|Manufacturerrecommendedage:3month-2years|Batteries:1AAAbatteriesrequired.(included),"show up to 2 reviews by default Say g'day with the Twist & Hug Koala Rattle. Twinkling heart button triggers phrases about feelings, fun facts about the koala, silly sounds and entertaining music and songs. When your little one gives the adorable koala toy a shake, it will respond with playful sounds and short tunes. Twisting the koala's colorful textured ears develop fine motor skills. The textured handle is perfectly sized for little ones to hold, while the sliding rings and koala bead promote tactile stimulation. Shake and play on the go with the cute koala baby rattle! Intended for ages 3-24 months. Requires 1 AAA battery. Battery included for demo purposes only, new battery recommended for regular use. | 8.5 ounces (View shipping rates and policies)",8.5 ounces,"",https://images-na.ssl-images-amazon.com/images/I/41rulumRSTL.jpg|https://images-na.ssl-images-amazon.com/images/I/41Q3PJ9aoaL.jpg|https://images-na.ssl-images-amazon.com/images/I/41ZuCI2XiwL.jpg|https://images-na.ssl-images-amazon.com/images/I/4119Qg5nZTL.jpg|https://images-na.ssl-images-amazon.com/images/I/41NQCjWkogL.jpg|https://images-na.ssl-images-amazon.com/images/I/41p4XJCWaDL.jpg|https://images-na.ssl-images-amazon.com/images/I/41znMsplIUL.jpg|https://images-na.ssl-images-amazon.com/images/G/01/x-locale/common/transparent-pixel.jpg,"",,https://www.amazon.com/VTech-Twist-Hug-Koala-Rattle/dp/B07GXMCWT5,,,,,,,Y,,
2d835e536f3e4aed4005091fe3955ebb,"LAMO 5"" Vinyl Figure - Legacy Gamers Dr Disrespect, Red",,,"","",,$19.50,,29006,"Make sure this fits by entering your model number. | 5” stylized Dr DisRespect figure comes with a unique, one-time-use QR card that unlocks the character in the free LAMO: AR vinyl app. | LAMO is a fast paced, free-to-play, online multiplayer party game. | LAMO is a 3-part ecosystem: (1) a fun online party game, (2) a covetable collectible vinyl figure and (3) a mobile app that connects the two, bridging the digital and the physical. | Collect, display and play with all LAMO vinyl figures. | LAMO is made by gamers, for gamers, with gamers.",ProductDimensions:5x5.2x7inches|ItemWeight:8ounces|ShippingWeight:8ounces(Viewshippingratesandpolicies)|ASIN:B07VMHS625|Itemmodelnumber:29006|Manufacturerrecommendedage:6yearsandup,"Style:Dr DisRespect show up to 2 reviews by default This 5” stylized vinyl Dr DisRespect figure comes with a unique, one-time-use QR card that unlocks the character in the free LAMO: AR vinyl app. The LAMO app is a fast paced, free-to-play, online multiplayer party game. Hyper intense snack sized rounds can be enjoyed back-to-back all day long or played as quick pickup games between rounds of your other favorite online titles. Just scan, unlock and play to enjoy a fun, next-level AR experience. Also use the app to keep track of your vinyl figure collection, view what characters are coming later & watch your collection grow over time. Every vinyl comes with a digital battle bundle, so fans can start playing the game on day-one as their favorite video game streamer. Proudly display your 5” stylized vinyl Dr DisRespect figure in your bedroom or on your desk! | 8 ounces (View shipping rates and policies)",8 ounces,"",https://images-na.ssl-images-amazon.com/images/I/41gD5AyOeNL.jpg|https://images-na.ssl-images-amazon.com/images/I/41fEVG-LshL.jpg|https://images-na.ssl-images-amazon.com/images/I/51wUFtbIxmL.jpg|https://images-na.ssl-images-amazon.com/images/I/41LLxEznX6L.jpg|https://images-na.ssl-images-amazon.com/images/I/41imbD0WUOL.jpg|https://images-na.ssl-images-amazon.com/images/I/41kJk9KT0HL.jpg|https://images-na.ssl-images-amazon.com/images/I/519bnC2K86L.jpg|https://images-na.ssl-images-amazon.com/images/G/01/x-locale/common/transparent-pixel.jpg,https://www.amazon.com/LAMO-Vinyl-Figure-Legacy-Disrespect/dp/B07VPLCN6L|https://www.amazon.com/LAMO-Vinyl-Figure-Legacy-Disrespect/dp/B07VMHS625|https://www.amazon.com/LAMO-Vinyl-Figure-Legacy-Disrespect/dp/B07VNHRZJY|https://www.amazon.com/LAMO-Vinyl-Figure-Legacy-Disrespect/dp/B07VPLHYDQ|https://www.amazon.com/LAMO-Vinyl-Figure-Legacy-Disrespect/dp/B07VQQ6S8F,,https://www.amazon.com/LAMO-Vinyl-Figure-Legacy-Disrespect/dp/B07VMHS625,,,,,,,Y,,
82be0dec20a875155a066440ef111310,"Marvel Avengers Assemble Captain America Costume T-Shirt with Mask, Small",,,"Clothing, Shoes & Jewelry | Novelty & More | Clothing | Novelty | Men | Shirts | T-Shirts","",,$10.36,,620029_S,"Make sure this fits by entering your model number. | 100% Cotton | Marvel Avengers Assemble Captain America Costume T-Shirt with Mask, Small | Printed shirt and molded half-mask | Officially licensed Marvel Universe merchandise inspired by the Disney XD cartoon Avengers Assemble",ProductDimensions:18x12x3inches|ItemWeight:4.8ounces|ShippingWeight:5ounces(Viewshippingratesandpolicies)|DomesticShipping:ItemcanbeshippedwithinU.S.|InternationalShipping:ThisitemcanbeshippedtoselectcountriesoutsideoftheU.S.LearnMore|ASIN:B00HA4YVH2|Itemmodelnumber:620029_S|Manufacturerrecommendedage:36months-4years,"Size:Small show up to 2 reviews by default Product Description Rubie's Costume Company has designed quality costume and fun clothing for decades. Trusted to be the leader of cosplay, Halloween, and general decor items, Rubie's does not sacrifice quality for price. Expect the highest in costume design and material with Rubie's. From the Manufacturer Marvel Comics and Rubies Costume Company have teamed to outfit you in all the costumes and accessories you need to dress as all of your favorite heroes and villains. Since 1951 Rubies has been the world's leader in costumes, decor and accessories, to make celebrating safe and fun. From witches and pirates to vampires and zombies, from Graceland to galaxies far, far away, we know that the Rubies' Costume Collection will inspire you to a bigger and better Halloween season. Mascots, rental quality costumes, masks, wigs, accessories, shoes and every significant licensed costume you want to wear can be found under the Rubies' brand. Still family owned, still family focused; Rubies' brings you fun for every season, Halloween, Christmas, Mardi Gras, Easter and all in-between. | 5 ounces (View shipping rates and policies)",5 ounces,"",https://images-na.ssl-images-amazon.com/images/I/41V2T9EMMJL.jpg|https://images-na.ssl-images-amazon.com/images/I/415SzB9YT3L.jpg|https://images-na.ssl-images-amazon.com/images/I/51I1fFrEGlL.jpg|https://images-na.ssl-images-amazon.com/images/I/41FRydmHcrL.jpg|https://images-na.ssl-images-amazon.com/images/G/01/x-locale/common/transparent-pixel.jpg,https://www.amazon.com/Avengers-Assemble-Captain-America-Costume/dp/B0735MV4X1|https://www.amazon.com/Avengers-Assemble-Captain-America-Costume/dp/B00HA4YVH2|https://www.amazon.com/Avengers-Assemble-Captain-America-Costume/dp/B00HA4YUZU|https://www.amazon.com/Avengers-Assemble-Captain-America-Costume/dp/B00HA4YV7M,,https://www.amazon.com/Avengers-Assemble-Captain-America-Costume/dp/B00HA4YVH2,,,,,,,Y,,
4cd74df98f6a204869dbc31ba3749d3c,"Vallejo Game Color Sunblast Yellow Paint, 17ml",,,Toys & Games | Hobbies | Hobby Building Tools & Hardware | Paints,"",,$3.06,,"",This range contains all the frequently used colors in fantasy figures | 16 highly pigmented acrylic colors formulated to provide especially mat and opaque coatings | When applied over a basecoat they enter into the folds and grooves of the figure and instantly bring forth the features,"","","","",https://images-na.ssl-images-amazon.com/images/I/4184h6kKK7L.jpg|https://images-na.ssl-images-amazon.com/images/G/01/x-locale/common/transparent-pixel.jpg,"",,https://www.amazon.com/Vallejo-Color-Sunblast-Yellow-Paint/dp/B000PH7NDU,,,,,,,Y,,
74c5d3de523d24384aa913b71d29689b,"Mudpuppy Unicorn Magic Activity Coloring Roll, Age 4+, Creative Fun with Coloring, Mazes, Spot The Difference and More, Includes 5 Colored Pencils, Easy to Store Unicorn Paper Roll",,,Toys & Games | Arts & Crafts,"",,$6.99,,9780735353916,"Make sure this fits by entering your model number. | 6 FEET OF FUN: The innovatively designed Unicorn Magic Activity Roll is 6’ long x 7” wide for long-lasting fun! Kids will be surprised as they unroll each section to see a new activity. Do one at a time or pull out the entire roll for a fun group project. | CREATIVE PLAY: Kids ages 4 and up will love the unicorn-themed activities including coloring, mazes, spot the difference, and more! Each activity sheet is perforated to complete one at a time, take along with you or display proudly on the wall. | INCLUDES COLORED PENCILS: The fun roll of activities is ready to use as soon as you open the box! Five bright colored pencils in blue, pink, orange, purple, and yellow are included to create hours of unicorn artwork. | TAKE IT WITH YOU: Cleanup and storage could not be easier because the self-contained unicorn activity paper easily rolls back inside the 8” x 8” x 2” box after kids are done playing. Great size to take with you for artistic time away from home. | SCREEN-FREE FUN: For over 25 years, Mudpuppy has created quality non-digital puzzles, games, and toys for children and families that facilitate creative play and imaginative thinking. All Mudpuppy products adhere to CPSIA, ASTM, and CE Safety Regulations.",ProductDimensions:8.2x2.5x2.5inches|ItemWeight:1.6ounces|ShippingWeight:2.08ounces(Viewshippingratesandpolicies)|DomesticShipping:ItemcanbeshippedwithinU.S.|InternationalShipping:ThisitemcanbeshippedtoselectcountriesoutsideoftheU.S.LearnMore|ASIN:0735353913|Itemmodelnumber:9780735353916|Manufacturerrecommendedage:4-10years,"Go to your orders and start the return Select the ship method Ship it! | Go to your orders and start the return Select the ship method Ship it! | Style:Unicorn Magic Let your child’s artistic creativity and imagination run free with the Mudpuppy Unicorn Magic Activity Roll. The innovatively-designed coloring roll is 6’ long x 7” wide for long-lasting fun! Kids ages 4 and up will be surprised as they unroll each section to see a new unicorn-themed challenge including coloring, mazes, spot the difference, and more! Each activity sheet is perforated to tear out one at a time, take along with you or display proudly on the wall. Pull out the entire roll for a fun group activity! The magical roll of activities is ready to use as soon as you open the box! Five bright colored pencils in blue, pink, orange, purple, and yellow are included to create hours of unicorn artwork. Cleanup and storage could not be easier because the self-contained unicorn activity paper easily rolls back inside the 8” x 8” x 2” box after kids are done playing. Great size to take with you for artistic time away from home. For over 25 years, Mudpuppy has created quality non-digital puzzles, games, and toys for children and families that facilitate creative play and imaginative thinking. All Mudpuppy products adhere to CPSIA, ASTM, and CE Safety Regulations. Environmentally conscious, the packaging contains 80% recycled paper and it is printed with nontoxic inks. | 2.08 ounces (View shipping rates and policies)",2.08 ounces,"",https://images-na.ssl-images-amazon.com/images/I/41-DrZEjVaL.jpg|https://images-na.ssl-images-amazon.com/images/I/31D7KElW8PL.jpg|https://images-na.ssl-images-amazon.com/images/I/51KszLLINML.jpg|https://images-na.ssl-images-amazon.com/images/I/41mFtTGzT2L.jpg|https://images-na.ssl-images-amazon.com/images/G/01/x-locale/common/transparent-pixel.jpg,https://www.amazon.com/Mudpuppy-Unicorn-Magic-Activity-Roll/dp/0735353921|https://www.amazon.com/Mudpuppy-Unicorn-Magic-Activity-Roll/dp/0735353891|https://www.amazon.com/Mudpuppy-Unicorn-Magic-Activity-Roll/dp/0735353905|https://www.amazon.com/Mudpuppy-Unicorn-Magic-Activity-Roll/dp/0735353913,,https://www.amazon.com/Mudpuppy-Unicorn-Magic-Activity-Roll/dp/0735353913,,,,,,,Y,,
43a663416f7a8325321942235dfa6ef7,Top Trumps Liverpool FC 18/19 Card Game,,,Toys & Games | Games & Accessories | Card Games,"",,$6.11,,5528059,Make sure this fits by entering your model number. | number of players: 6,ProductDimensions:3.5x0.5x5.5inches|ItemWeight:3.52ounces|ShippingWeight:3.52ounces(Viewshippingratesandpolicies)|ASIN:B07L9K5VDS|Itemmodelnumber:5528059|Manufacturerrecommendedage:6yearsandup,"Go to your orders and start the return Select the ship method Ship it! | Go to your orders and start the return Select the ship method Ship it! | Color:Liverpool Fc show up to 2 reviews by default YNWA! Come on you Reds! Liverpool FC fans, it’s time to show your colours with this 2018/19 Liverpool FC Top Trumps pack. It’s bursting with awesome trivia and fun stats on all the players from the current team. Featuring all your favourites from Milner, Van Dijk and Robertson, to the triumphant trio of Mane, Firmino and Salah! | 3.52 ounces (View shipping rates and policies)",3.52 ounces,"",https://images-na.ssl-images-amazon.com/images/I/41M2zyAIx0L.jpg|https://images-na.ssl-images-amazon.com/images/I/51oA5m2mYgL.jpg|https://images-na.ssl-images-amazon.com/images/I/51L4qCx2--L.jpg|https://images-na.ssl-images-amazon.com/images/I/51d4nj4AdrL.jpg|https://images-na.ssl-images-amazon.com/images/I/51s6kFHLC%2BL.jpg|https://images-na.ssl-images-amazon.com/images/G/01/x-locale/common/transparent-pixel.jpg,https://www.amazon.com/Top-Trumps-Liverpool-Card-Game/dp/B07LCS2GCN|https://www.amazon.com/Top-Trumps-Liverpool-Card-Game/dp/B07LCW13Z2|https://www.amazon.com/Top-Trumps-Liverpool-Card-Game/dp/B07L9K5VDS|https://www.amazon.com/Top-Trumps-Liverpool-Card-Game/dp/B07L5PRLX5|https://www.amazon.com/Top-Trumps-Liverpool-Card-Game/dp/B0794JD72J|https://www.amazon.com/Top-Trumps-Liverpool-Card-Game/dp/B07HGPT32L,,https://www.amazon.com/Top-Trumps-Liverpool-Card-Game/dp/B07L9K5VDS,,,,,,,Y,,
f1a2c4a6317e54e9c76377c79eb35201,Hot Wheels Track Builder Straight Track with Car AND Hot Wheels Race Case Track Set,,,Toys & Games | Dress Up & Pretend Play | Pretend Play | Kitchen Toys,,,$19.98,,"","Make sure this fits by entering your model number. | Cool combination of Hot Wheels track and one car for big customizing fun | Includes 18 track connectors: an assortment of 9-inch track, 12-inch track, and track connectors | Race and rank your favorite Hot Wheels vehicles | Dual launcher for side-by-side racing showdowns",ShippingInformation:Viewshippingratesandpolicies|ASIN:B07TQNPFL5,"","","",https://images-na.ssl-images-amazon.com/images/I/41XFzOI48fL.jpg|https://images-na.ssl-images-amazon.com/images/G/01/x-locale/common/transparent-pixel.jpg,"",,https://www.amazon.com/Hot-Wheels-Track-Builder-Straight/dp/B07TQNPFL5,,,,,,,Y,,
c4c4257e9c0a5257ed3affae5c568aae,"Wild Republic Mermaid Toy, Slap Bracelet, Gifts for Kids, Purple, Huggers 12""",,,"","",,$7.99,,21403,"Make sure this fits by entering your model number. | Let your child be a part of the magical world of Mermaids, with this adorable slap bracelet. | It is a wearable slap bracelet and companion All in one, huggers are the gift that hugs you back. | Huggers are enjoyed by all ages, making perfect toys for kids, and even fun gifts for teens who enjoy clipping the snap bracelet on various items. | Approximate size of this mermaid accessory is 12"" When spread out and is made of a high quality material which contributes to the comfy feel. | Mermaids never go out of style and neither will you!",ProductDimensions:4x0.2x12inches|ItemWeight:1.28ounces|ShippingWeight:1.92ounces(Viewshippingratesandpolicies)|ShippingAdvisory:Thisitemmustbeshippedseparatelyfromotheritemsinyourorder.Additionalshippingchargeswillnotapply.|ASIN:B07B9VVHWN|Itemmodelnumber:21403|Manufacturerrecommendedage:0monthsandup,"Color:Purple Totally cool! What’s that on your wrist? It's a Huggers! Our Huggers conform to your wrist, so one size fits all! They come in radical styles and they are very detailed! Hug one on your backpack. Hug one on your doorknob! Huggers like to hug everything they can! Huggers make great gifts & kids love them! It's like having a buddy to play with all the time, and an awesome bracelet in one! Everyone loves hugs! Get yours today! | 1.92 ounces (View shipping rates and policies)",1.92 ounces,"",https://images-na.ssl-images-amazon.com/images/I/41GhLOkqL4L.jpg|https://images-na.ssl-images-amazon.com/images/I/41OWF6sLpNL.jpg|https://images-na.ssl-images-amazon.com/images/I/410q0qrFbAL.jpg|https://images-na.ssl-images-amazon.com/images/I/51dgM2gVWxL.jpg|https://images-na.ssl-images-amazon.com/images/G/01/x-locale/common/transparent-pixel.jpg,"",,https://www.amazon.com/Wild-Republic-Mermaid-Bracelet-Huggers/dp/B07B9VVHWN,,,,,,,Y,,
9ab3556ad20a8d9c1595d298972b2eae,Melissa & Doug Annie Doll & Feeding Set Bundle,,,Toys & Games | Dolls & Accessories | Dolls,,,$24.99,,"","",ShippingInformation:Viewshippingratesandpolicies|ASIN:B01LWQ2H1T,"","","",https://images-na.ssl-images-amazon.com/images/I/31zUOuZppEL.jpg|https://images-na.ssl-images-amazon.com/images/G/01/x-locale/common/transparent-pixel.jpg,"",,https://www.amazon.com/Melissa-Doug-Annie-Feeding-Bundle/dp/B01LWQ2H1T,,,,,,,Y,,
52c1091bb950f7466507179ac0bcbb86,"LeapFrog LeapStart Preschool 4-in-1 Activity Book Bundle with ABC, Shapes & Colors, Math, Animals",,,Toys & Games | Kids' Electronics | Electronic Learning Toys,"",,$38.33,,80-489400,"Make sure this fits by entering your model number. | Includes alphabet adventures with music, Scout & friends math with problem solving, shapes & colors with creativity, and the world of baby animals life science and memory skills perfect for ages 2-4 | Alphabet adventures: teaches 14 alphabet and music skills including uppercase and lowercase letters, letter sounds, exploring music and rhythms also includes a spinning dial that teaches vowel sounds | Scout & friends math: teaches 12 preschool math and problem solving skills, such as matching quantities to numbers, counting to 10, comparing sets of objects | Shapes & colors: teaches 14 shapes, colors and creativity skills, matching shapes, identifying and extending patterns, creating rhythms and more | The world of baby animals: teaches world animals, life science and memory skills such as exploring different animal traits and habitats, practicing with science-related vocabulary, recalling object locations and more",ProductDimensions:7.5x1.5x7inches|ItemWeight:1.93pounds|ShippingWeight:2pounds(Viewshippingratesandpolicies)|ASIN:B071FH42VT|Itemmodelnumber:80-489400|Manufacturerrecommendedage:24months-5years,"Go to your orders and start the return Select the ship method Ship it! | Go to your orders and start the return Select the ship method Ship it! | The leap start level 1 activity book bundle includes alphabet adventures, Scout & friends math, shapes & colors and the world of baby animals. Join leap, Tad and Lily in alphabet adventures as they meet letters A-Z at the letter factory. SCOUT & friends math lets kids join Scout and his friends as they play and explore counting, number recognition and problem solving. Visit a prehistoric world in shapes & colors that’s filled with dinosaur friends and introduces shapes and colors. Learn and play with all your favorite baby animals in the world of baby animals. Perfect for ages 2-5, these activity books each include 30+ replayable activities and 25+ reward stickers. Activity books are compatible with all leap start systems (sold separately). | 2 pounds (View shipping rates and policies)",2 pounds,"",https://images-na.ssl-images-amazon.com/images/I/615u%2Bwxoh6L.jpg|https://images-na.ssl-images-amazon.com/images/I/51i3Ftoj6ML.jpg|https://images-na.ssl-images-amazon.com/images/I/51WpNtxqWNL.jpg|https://images-na.ssl-images-amazon.com/images/I/51eX7YHwuLL.jpg|https://images-na.ssl-images-amazon.com/images/I/51qVRynt3xL.jpg|https://images-na.ssl-images-amazon.com/images/I/51UkFL66JoL.jpg|https://images-na.ssl-images-amazon.com/images/I/514u3QCLTrL.jpg|https://images-na.ssl-images-amazon.com/images/G/01/x-locale/common/transparent-pixel.jpg,"",,https://www.amazon.com/LeapFrog-LeapStart-Preschool-Activity-Animals/dp/B071FH42VT,,,,,,,Y,,
cb7fc27339298ae31485ce70a774f6cb,Sherlock Holmes - The Challenge of Irene Adler,,,Toys & Games | Games & Accessories,"",,$16.43,,VRGGNA07,"Make sure this fits by entering your model number. | In Sherlock Holmes: the challenge of Irene Adler, there is a new detective in town! | Irene is now competing with the Baker street boys for business. But will she truly be able to rival the skills of Sherlock? | Play solo, or head to head against another player Each taking on the role of either Sherlock Holmes or Irene Adler. | Only by using your Wits will you prove yourself to be London's greatest detective! | Will you best your opponent in this battle of wits? Or will your opponent come out on top?",ProductDimensions:8.5x6x0.5inches|ItemWeight:12.6ounces|ShippingWeight:12.6ounces(Viewshippingratesandpolicies)|ASIN:0999769863|Itemmodelnumber:VRGGNA07|Manufacturerrecommendedage:14yearsandup,"Go to your orders and start the return Select the ship method Ship it! | Go to your orders and start the return Select the ship method Ship it! | In Sherlock Holmes: the challenge of Irene Adler, there is a new detective in town! Irene is now competing with the baker street boys for business. But will she truly be able to rival the skills of Sherlock? Play solo, or head to head against another player Each taking on the role of either Sherlock Holmes or Irene Adler. Only by using your wits will you prove yourself to be London's greatest detective! Will you best your opponent in this battle of wits? Or will your opponent come out on top?  made in France. | 12.6 ounces (View shipping rates and policies)",12.6 ounces,"",https://images-na.ssl-images-amazon.com/images/I/41%2BC4DiNNKL.jpg|https://images-na.ssl-images-amazon.com/images/G/01/x-locale/common/transparent-pixel.jpg,"",,https://www.amazon.com/Sherlock-Holmes-Challenge-Irene-Adler/dp/0999769863,,,,,,,Y,,
5483f67f50a97a8dd7f404f80eab75e1,Great Eastern Entertainment Boys Attack On Titan - Levi Wallet,,,"Clothing, Shoes & Jewelry | Men | Accessories | Wallets, Card Cases & Money Organizers | Wallets",,,$24.53,,80310,Make sure this fits by entering your model number. | Fully Licensed | Quality Materials | Perfect Gift for Anime Lovers,ProductDimensions:4.2x3.8x1.5inches|ItemWeight:1.6ounces|ShippingWeight:1.6ounces(Viewshippingratesandpolicies)|DomesticShipping:ItemcanbeshippedwithinU.S.|InternationalShipping:ThisitemcanbeshippedtoselectcountriesoutsideoftheU.S.LearnMore|ASIN:B00T3NJ9WU|Itemmodelnumber:80310|Manufacturerrecommendedage:13months-8years,"High quality, fully licensed wallet, which is sure to make any Anime fan thrilled. Sturdy construction, high quality graphics, and fully functional. | 1.6 ounces (View shipping rates and policies)",1.6 ounces,"",https://images-na.ssl-images-amazon.com/images/I/51zGt6JwRKL.jpg|https://images-na.ssl-images-amazon.com/images/G/01/x-locale/common/transparent-pixel.jpg,"",,https://www.amazon.com/Great-Eastern-Entertainment-Attack-Titan/dp/B00T3NJ9WU,,,,,,,Y,,
